1159602049148948481,CooperativaJEP,En tus #VacacionesAlMáximo disfruta de promociones y descuentos exclusivos en hospedaje y estadía con #TarjetasJEP. Más información http://bit.ly/2YvofJo pic.twitter.com/sl9qeoZQqp,2019-08-08 23:07:27+00:00,4,0,#VacacionesAlMáximo #TarjetasJEP,Azogues
1158375712233021446,peluditoscuenc,Tenemos en hospedaje un gigante llamado #Chaplin es del mismo tamaño que #Dilan pero de una ternura y amor únicos #CasaDeLosPeluditos … https://www.instagram.com/p/B0yOJXWpHWy/?igshid=1etw7zcgst5gc …,2019-08-05 13:54:26+00:00,1,1,#Chaplin #Dilan #CasaDeLosPeluditos,Azogues
1132859665686192129,patoedg,Lo imperativo de q exista regulacion y control a este tipo de hospedaje q garantice seguridad a quien lo utilice @fenacapturec @TurismoEc @Captur_Azuay @TurismoCuencaEChttps://elcomercio.pe/mundo/latinoamerica/muerte-brasilenos-intoxicados-chile-plantea-dudas-airbnb-noticia-638145 …,2019-05-27 04:02:46+00:00,5,2,,Azogues
1125740392396333056,patoedg,Siguen en otros países problemas con @arbnb q auspicia la informalidad lo q se debe hacer es formalizar a quienes ofrecen hospedaje por estas plataformas virtuales @fenacapturec @TurismoEc @tomebambahttps://www.cnnchile.com/economia/airbnb-arriendo-departamento-las-condes_20190321/ …,2019-05-07 12:33:19+00:00,5,4,,Azogues
1125186772277895168,llerenagilces28,Quinta San Martin gracias por el excelente hospedaje. #HermosoLugarpic.twitter.com/LfbB8eLJfa,2019-05-05 23:53:26+00:00,2,1,#HermosoLugarpic,Azogues
1154219482593804288,hostelnucapacha,Si tenemos vacantes si. Sino podemos hacer un intercambio con hospedaje,2019-07-25 02:39:03+00:00,0,0,,Biblian
1153028070217080832,serviplatinium,Serviplatinium Rent_A_House Hospedaje Alojamiento En Guayaquil - Guayas - Ecuador Casa Amoblada Guayas vía Samborondon km 10.5 Urbanizacion Marinado'r Park mz 18 Urb. la Marina Samborondón (04) 506-1151 https://maps.google.com/?cid=18390680761085800221 …,2019-07-21 19:44:48+00:00,0,0,,Biblian
1152773687461986304,serviplatinium,Hospedaje en Guayaquil #hospedajeenguayaquilhttps://abnb.me/44A8YNw5oY,2019-07-21 02:53:59+00:00,0,0,#hospedajeenguayaquilhttps,Biblian
1151988596062035971,serviplatinium,Hospedaje en Guayaquil https://abnb.me/Br2V9aqWdY,2019-07-18 22:54:18+00:00,0,0,,Biblian
1151712717574721542,after_my,#TweetSerio. Estoy buscando a alguien que este alquilando y este dispuesta en compartir hospedaje... #Guayaquil,2019-07-18 04:38:04+00:00,0,0,#TweetSerio #Guayaquil,Biblian
1151566711155503105,serviplatinium,Hospedaje en Guayaquil reservas al tf : 0994795665 https://abnb.me/44A8YNw5oY,2019-07-17 18:57:53+00:00,0,0,,Biblian
1150032245962543105,Walterick,Se les quite el plan celular y hospedaje y que lo paguen con su sueldo como cualquier ciudadano ecuatoriano.,2019-07-13 13:20:28+00:00,1,0,,Biblian
1149132781651484675,serviplatinium,Hospedaje en Guayaquil https://abnb.me/Br2V9aqWdY,2019-07-11 01:46:19+00:00,0,0,,Biblian
1149117370297933824,oswaldob26,Además reciben como $150 diarios de viáticos cuando tienen hospedaje alimentación e implementos.,2019-07-11 00:45:05+00:00,0,0,,Biblian
1146796612087373824,serviplatinium,Serviplatinium Rent_A_House Hospedaje Alojamiento En Guayaquil - Guayas - Ecuador Casa Amoblada Guayas vía Samborondon km 10.5 Urbanizacion Marinado'r Park mz 18 Urb. la Marina Samborondón (04) 506-1151 https://maps.app.goo.gl/816xnj2XKN2XMXj8A …,2019-07-04 15:03:13+00:00,1,0,,Biblian
1145732997674610688,serviplatinium,Hospedaje en Guayaquil https://abnb.me/lJ7UAE0mYX,2019-07-01 16:36:47+00:00,1,0,,Biblian
1143921582685007872,serviplatinium,Serviplatinium Rent_A_House Hospedaje Alojamiento En Guayaquil - Guayas - Ecuador Casa Amoblada Guayas vía Samborondon km 10.5 Urbanizacion Marinado'r Park mz 18 Urb. la Marina Samborondón (04) 506-1151 https://maps.app.goo.gl/816xnj2XKN2XMXj8A …,2019-06-26 16:38:53+00:00,1,0,,Biblian
1142799613939855361,serviplatinium,Hospedaje en Guayaquil https://abnb.me/pdTwUnBzIX,2019-06-23 14:20:34+00:00,1,0,,Biblian
1142283916679831552,serviplatinium,Hospedaje en Guayaquil reservas aqui https://abnb.me/pdTwUnBzIX,2019-06-22 04:11:23+00:00,1,0,,Biblian
1139958919000989696,serviplatinium,Serviplatinium Rent_A_House Hospedaje Alojamiento En Guayaquil - Guayas - Ecuador Casa Amoblada Guayas vía Samborondon km 10.5 Urbanizacion Marinado'r Park mz 18 Urb. la Marina Samborondón (04) 506-1151 https://maps.app.goo.gl/816xnj2XKN2XMXj8A …,2019-06-15 18:12:40+00:00,1,0,,Biblian
1137920539157323776,serviplatinium,Serviplatinium Rent_A_House Hospedaje Alojamiento En Guayaquil - Guayas - Ecuador Casa Amoblada Guayas vía Samborondon km 10.5 Urbanizacion Marinado'r Park mz 18 Urb. la Marina Samborondón (04) 506-1151 https://maps.app.goo.gl/816xnj2XKN2XMXj8A …,2019-06-10 03:12:52+00:00,1,0,,Biblian
1137033401851158528,serviplatinium,Hospedaje en Guayaquil tf : +593-994795665 #hospedajeenguayaquil #hospedaje https://abnb.me/1oUkktAwkX,2019-06-07 16:27:42+00:00,0,0,#hospedajeenguayaquil #hospedaje,Biblian
1132742594956541953,GLOSS_193,Esperemos que esto si suceda y estas personas puedan ayudar a otras ARMY’s que necesitan hospedaje pero primero @BigHitEnt ya confirma más fechas @BTS_twthttps://twitter.com/1Chimin/status/1132453251033509888 …,2019-05-26 20:17:34+00:00,3,1,,Biblian
1130307720614174720,serviplatinium,Hospedaje en Guayaquil https://abnb.me/x2ywb5PIPW,2019-05-20 03:02:15+00:00,0,0,,Biblian
1129879976701059073,JorgeRojasCr,¿Qué seguridad jurídica hay por dar servicio de hospedaje en internet o tienen mis clientes de que un "Fiscal" pida allanar servidores alquilados a una empresa para poder brindar servicios informáticos? Todos los que estudiamos informática estamos jodidos #FreeOlaBini #InaPapershttps://twitter.com/FiscaliaEcuador/status/1129574042195963904 …,2019-05-18 22:42:33+00:00,391,308,#FreeOlaBini #InaPapershttps,Biblian
1129382951702192128,serviplatinium,HOSPEDAJE en Guayaquil reservas tf +593-0994795665 https://abnb.me/IFWS3ncuLW,2019-05-17 13:47:33+00:00,0,0,,Biblian
1125152525718564865,serviplatinium,Hospedaje en Guayaquil casa amoblada https://abnb.me/JXGREiW6rW,2019-05-05 21:37:21+00:00,0,0,,Biblian
1120739881465069568,serviplatinium,Hospedaje en Guayaquil reservas aquí #hospedaje https://abnb.me/kfKJCZUT7V,2019-04-23 17:23:04+00:00,0,0,#hospedaje,Biblian
1158374453283360769,LuisGranadosV1A,Conoces el Páramo de Santurban?... Fuí visita al maravilloso Páramo de Santurban. Lagunas de Páez en California Santander.. A más 3666 msnm se disfruta de una paz indescriptible. Me alojé en el Hospedaje de Alonso… https://www.instagram.com/p/B0yNkgHgcS8/?igshid=1bg471pyilehq …,2019-08-05 13:49:25+00:00,0,0,,Giron
1158195273883160577,AdiestraEducani,Mi primero días en Educanino Piedecuesta ACADÉMIA Y HOSPEDAJE +57 3184475595 CURSOS Y TALLERES PERSONALIZADOS INCLUYEN COACHING GUÍA CANINO PARA TODA LA FAMILIA #CRIANZA #CACHORROS #EDUCACION… https://www.instagram.com/p/B0w8CZqgqFN/?igshid=13z561l9c3je7 …,2019-08-05 01:57:26+00:00,0,0,#CRIANZA #CACHORROS #EDUCACION,Giron
1157421199263227905,undervivi,Un viaje de 7 horas desde Barranca hasta Magangué que incluye un transbordo en chalupa a un lugar donde no conozco a nadie pagar hospedaje y comida. Un viaje de un día y ¿adivinen? No cuento con ese dinero.,2019-08-02 22:41:32+00:00,3,0,,Giron
1156900321941176321,Divagando_ando,Para que vayan anotando: Cuando se trata de fallas técnicas la aerolínea debe brindar alimentación u hospedaje a los pasajeros. Ayer @Avianca no dio ni el servicio a bordo,2019-08-01 12:11:45+00:00,1,0,,Giron
1155537502549229574,ENRIQUECORTES86,Ya pedí formalmente vía e-mail la corrección de mi exclusión del listado para la exhibición del 11 de agosto. Tengo pasajes aéreos hospedaje todo listo menos el reconocimiento para asistir.,2019-07-28 17:56:24+00:00,4,3,,Giron
1152947051967254528,AdiestraEducani,LA GENTE NO NACE - SE HACE Educanino Piedecuesta ACADÉMIA Y HOSPEDAJE +57 3184475595 CURSOS Y TALLERES PERSONALIZADOS INCLUYEN COACHING GUÍA CANINO PARA TODA LA FAMILIA. #CACHORROS #DOGS… https://www.instagram.com/p/B0LpenTgqzd/?igshid=1k434niup2rj4 …,2019-07-21 14:22:52+00:00,0,0,#CACHORROS #DOGS,Giron
1150953576921014272,AdiestraEducani,La vida es mucho mejor con un perruno bien adiestrado en Educanino Piedecuesta ACADÉMIA Y HOSPEDAJE CEL-WHATSAPP +57 3184475595 CURSOS Y TALLERES PERSONALIZADOS INCLUYEN COACHING GUÍA CANINO PARA TODA LA FAMILIA… https://www.instagram.com/p/BvobstYAyOz/?igshid=axjwyqdvvk11 …,2019-07-16 02:21:31+00:00,0,0,,Giron
1150952566513164288,AdiestraEducani,Una extraordinaria OPORTUNIDAD de conseguir un PASTOR ALEMÁN linea de trabajo muy especial. Educanino Piedecuesta ACADÉMIA Y HOSPEDAJE +57 3184475595 en Educanino https://www.instagram.com/p/Bz9efTbA1PV/?igshid=g1jsgv8owmyw …,2019-07-16 02:17:30+00:00,0,0,,Giron
1150602853406277633,AdiestraEducani,PASTOR ALEMÁN - PROTECTOR - NOBLEZA - LEALTAD Lo mejor para Ti Educanino Piedecuesta ACADÉMIA Y HOSPEDAJE +57 3184475595 #CACHORROS #PASTOR ALEMÁN #WORKINGDOGS #PASIÓN #EXCELENCIA #DOGLOVERS #PERROS en Educanino https://www.instagram.com/p/Bz6_ddlAJDs/?igshid=gunxgimbavcl …,2019-07-15 03:07:52+00:00,1,0,#CACHORROS #PASTOR #WORKINGDOGS #PASIÓN #EXCELENCIA #DOGLOVERS #PERROS,Giron
1149875421388955649,AdiestraEducani,Having some fun after working en Educanino Piedecuesta ACADÉMIA Y HOSPEDAJE +57 3184475595 lovley guis #Doglovers #CACHORROS #DOGS #WORKINGDOGS #PETS #PUPPIES #DOGGIES #EDUCACIÓN #ADIESTRAMIENTO #ENTRENAMIENTO… https://www.instagram.com/p/Bz10qWkA2Ms/?igshid=93jqdsl0fi7n …,2019-07-13 02:57:18+00:00,0,0,#Doglovers #CACHORROS #DOGS #WORKINGDOGS #PETS #PUPPIES #DOGGIES #EDUCACIÓN #ADIESTRAMIENTO #ENTRENAMIENTO,Giron
1148420326105071616,AdiestraEducani,QUIEN NO ESTUDIA NO APRENDE - QUIERO SER CAMPEÓN - Educanino Piedecuesta ACADÉMIA Y HOSPEDAJE +57 3184475595 CURSOS Y TALLERES PERSONALIZADOS INCLUYEN COACHING GUÍA CANINO PARA TODA LA FAMILIA… https://www.instagram.com/p/Bzre9LPgPUj/?igshid=1v2snj6rexaab …,2019-07-09 02:35:17+00:00,0,0,,Giron
1148229375344558081,AdiestraEducani,APRENDER ES UN DEBER PARA APORTAR A UNA NECESIDADEducanino Piedecuesta ACADÉMIA Y HOSPEDAJE +57 3184475595 CURSOS Y TALLERES PERSONALIZADOS INCLUYEN COACHING GUÍA CANINO PARA TODA LA FAMILIA… https://www.instagram.com/p/BzqIIKEgVwV/?igshid=aoib262lsxjp …,2019-07-08 13:56:30+00:00,0,0,,Giron
1146927606543130625,AdiestraEducani,Culminando el CURSO OBEDIENCIA CANINA INTERNACIONAL NIVEL AVANZADO con mucha DIVERSIÓN en Educanino Piedecuesta ACADÉMIA Y HOSPEDAJE CEL-WHATSAPP +57 3184475595 CURSOS Y TALLERES PERSONALIZADOS INCLUYEN… https://www.instagram.com/p/BwLgo2IBWRz/?igshid=o267llcm7q87 …,2019-07-04 23:43:44+00:00,0,0,,Giron
1145783740179894272,AdiestraEducani,#EDUCACIÓN #ADIESTRAMIENTO #ENTRENAMIENTO #OBEDIENCIA #CANINA #INTERNACIONAL con #ESTILO #ALEMÁN - Go Go - #GUARDERIA Educanino Piedecuesta ACADÉMIA Y HOSPEDAJE +57 3184475595 CURSOS Y TALLERES PERSONALIZADOS… https://www.instagram.com/p/BzYKKsVAtph/?igshid=1ilq41wo9anb7 …,2019-07-01 19:58:25+00:00,0,0,#EDUCACIÓN #ADIESTRAMIENTO #ENTRENAMIENTO #OBEDIENCIA #CANINA #INTERNACIONAL #ESTILO #ALEMÁN #GUARDERIA,Giron
1145700649474170881,AdiestraEducani,#EDUCACIÓN #ADIESTRAMIENTO #ENTRENAMIENTO #OBEDIENCIA #CANINA #INTERNACIONAL con #ESTILO #ALEMÁN - Go Go - #GUARDERIA Educanino Piedecuesta ACADÉMIA Y HOSPEDAJE +57 3184475595 CURSOS Y TALLERES PERSONALIZADOS… https://www.instagram.com/p/BzYKKsVAtph/?igshid=1abmunzb4lrqv …,2019-07-01 14:28:15+00:00,0,0,#EDUCACIÓN #ADIESTRAMIENTO #ENTRENAMIENTO #OBEDIENCIA #CANINA #INTERNACIONAL #ESTILO #ALEMÁN #GUARDERIA,Giron
1134311307895644162,AdiestraEducani,ORGULLOSAMENTE ALUMNA en Educanino Piedecuesta ACADÉMIA Y HOSPEDAJE +57 3184475595 #OBEDIENCIA #EDUCACIÓN #SOCIALIZACION #MODIFICACION #ROTTWEILER #PERROS #MASCOTAS #PERRUNOS #CACHORROS #DOGS #WORKINGDOGS #PETS… https://www.instagram.com/p/ByHO67-AQeY/?igshid=94uu7dvtiap4 …,2019-05-31 04:11:04+00:00,2,0,#OBEDIENCIA #EDUCACIÓN #SOCIALIZACION #MODIFICACION #ROTTWEILER #PERROS #MASCOTAS #PERRUNOS #CACHORROS #DOGS #WORKINGDOGS #PETS,Giron
1128099537258725376,leonardorios28,tours para todos los fines de semanas desde Bucaramanga escríbenos 3157012422 o 3122096735 precios según la fecha buses full equipos hospedaje Rodadero. Estamos ubicados cll 53#18-25 las… https://www.instagram.com/p/BxbGIg0DrxJ/?utm_source=ig_twitter_share&igshid=985504hrhv8t …,2019-05-14 00:47:43+00:00,0,0,#18,Giron
1120397180509085696,undervivi,¿Las tutorías son con pasajes y hospedaje incluidos?,2019-04-22 18:41:18+00:00,0,0,,Giron
1160185098916040704,carturoleon,Te faltó decir viajar 6 8 12 horas por tierra sin hospedaje a duras penas algo de comer y directo al partido(hablo de las categorías menores) ni el agua muchas de las veces después de los entrenamientos y con 3 balones para todo el equipo y hecho huevo.,2019-08-10 13:44:17+00:00,1,0,,Sigsig
1124535048198344704,MinturZonal6,Cuando viajes anticipa tu hospedaje y planifica tu recorrido por tu seguridad y la de tu familia. #ViajaSeguroECpic.twitter.com/UaGVPBgl0I,2019-05-04 04:43:42+00:00,0,0,#ViajaSeguroECpic,Sigsig
1129066641768308739,gabyele10,Que me late que solo se lo han llevado a pasar sus últimos días de hospedaje en ese lugar ojalá sea eso y que no esté grave el trujillo,2019-05-16 16:50:39+00:00,0,0,,Loja
1124680695962533889,MinturZonal7,Cuando viajes anticipa tu hospedaje y planifica tu recorrido por tu seguridad y la de tu familia. #ViajaSeguroECpic.twitter.com/QatQi9jOra,2019-05-04 14:22:28+00:00,1,2,#ViajaSeguroECpic,Loja
1148333012796547073,PuntaPacificoOK,PUNTA PACÍFICO BUNGALOWjS MÁNCORA - Lunes 8 de Julio del 2019 - 14:00" hrs. Un resúmen de nuestro Hospedaje con cerca de 29 grados centígrados a pesar de estar en invierno. Nuestra Página Web:… https://www.instagram.com/p/Bzq2IaRHumJ/?igshid=g9eyn8a3rf6f …,2019-07-08 20:48:19+00:00,0,0,,Celica
1146485351403401217,PuntaPacificoOK,Máncora. Perú hoy miércoles 3 julio 2019 a las 06:30hrs. Se ve ya claro y sol radiante a pesar de estar en invierno. Se observa el acceso a la playa. Nuestro Hospedaje entrando a la mano izquierda. Buena época para… https://www.instagram.com/p/Bzdrr-enA-W/?igshid=1gwf90lcxuy1r …,2019-07-03 18:26:23+00:00,0,0,,Celica
1146484994212319232,PuntaPacificoOK,Máncora. Perú hoy miércoles 3 julio 2019 a las 06:30hrs. Se ve ya claro y sol radiante a pesar de estar en invierno. Se observa el acceso a la playa. Nuestro Hospedaje entrando a la mano izquierda. Buena época para… https://www.instagram.com/p/Bzdrr-enA-W/?igshid=rq91r4orppes …,2019-07-03 18:24:57+00:00,0,0,,Celica
1146484876104937473,PuntaPacificoOK,Máncora. Perú hoy miércoles 3 julio 2019 a las 06:30hrs. Se ve ya claro y sol radiante a pesar de estar en invierno. Se observa el acceso a la playa. Nuestro Hospedaje entrando a la mano izquierda. Buena época para… https://www.instagram.com/p/Bzdrr-enA-W/?igshid=1329v043lq43e …,2019-07-03 18:24:29+00:00,0,0,,Celica
1146484532679495682,PuntaPacificoOK,Máncora. Perú hoy miércoles 3 julio 2019 a las 06:30hrs. Se ve ya claro y sol radiante a pesar de estar en invierno. Se observa el acceso a la playa. Nuestro Hospedaje entrando a la mano izquierda. Buena época para… https://www.instagram.com/p/Bzdrr-enA-W/?igshid=gmcoc0cjljwy …,2019-07-03 18:23:07+00:00,0,0,,Celica
1146481152364093442,PuntaPacificoOK,Máncora. Perú hoy miércoles 3 julio 2019 a las 06:30hrs. Se ve ya claro y sol radiante a pesar de estar en invierno. Se observa el acceso a la playa. Nuestro Hospedaje entrando a la mano izquierda. Buena época para… https://www.instagram.com/p/Bzdrr-enA-W/?igshid=we2e2mtsvxd4 …,2019-07-03 18:09:41+00:00,0,0,,Celica
1127432399606829059,galitomiranda,en Hospedaje Sol De Mancora https://www.instagram.com/p/BxWWwWdnyC4ap9U1XIGx-26MgzxZS-eL_KuyVc0/?utm_source=ig_twitter_share&igshid=1nodsfjg5amsr …,2019-05-12 04:36:45+00:00,0,0,,Celica
1139015756795043840,julioGz10,Piensa que no tienes que gastar en hospedaje y transporte,2019-06-13 03:44:52+00:00,0,0,,Zapotillo
1137120533580001280,javyconfeti,¡PA’ QUETE-ANIMES!: Hospedaje + sesión de coaching emocional + desayuno continental + paseo por la ciudad en pulmonía + paseo en banana + barra libre + fiesta sorpresa: $1500 por noche. ¡Tu confeti-hogar en #Mazatlan ! pic.twitter.com/sq02pesMOM,2019-06-07 22:13:56+00:00,0,0,#Mazatlan,Zapotillo
1135930566262611971,Alberto_Herrera,Necesita hospedaje y chamba de casi cualquier cosa que le permita comenzar a tejer su nueva vida. "Sé manejar pintar hasta cositas de electrónica" me dice. Está solo. No tiene a nadie por acá más que a un muchacho que conoció en ese tren donde tantos han muerto.,2019-06-04 15:25:26+00:00,8,3,,Zapotillo
1135918522389880836,Alberto_Herrera,¿Y si hacemos un Airbnb pero para migrantes sin documentos? ¿Una red enorme de gente que pueda recibir a quienes necesitan hospedaje temporal mientras se buscan la vida en nuestra ciudad?,2019-06-04 14:37:34+00:00,44,5,,Zapotillo
