1130638282205925379,PoliciaMeta,#MásCercaDelCiudadano En Puerto Gaitán #Meta con #ProtecciónTurismo realizamos actividades de control al Registro Nacional de Turismo de los establecimientos de Alojamiento y Hospedaje del municipio para garantizar un #TurismoSeguro. #CódigoDeConvivenciapic.twitter.com/uWlp3lZVEN,2019-05-21 00:55:47+00:00,6,4,#MásCercaDelCiudadano #Meta #ProtecciónTurismo #TurismoSeguro #CódigoDeConvivenciapic,Puerto López
1130614889825951745,AnaMaGarcia10,#EncuentroSDS Lugar: Medellín Fecha: Confirmados: Tiquetes: Hospedaje: Ya casi ya casi,2019-05-20 23:22:50+00:00,2,1,#EncuentroSDS,Puerto López
1129028624693235716,MigracionCol,Oficiales de @MigracionCol realizaron labores de control y verificación y socializan la normatividad migratoria vigente en establecimientos que prestan servicios de hospedaje en Ibagué #SomosMigracionpic.twitter.com/sXLHuy9sB6,2019-05-16 14:19:35+00:00,1,2,#SomosMigracionpic,Puerto López
1128299441847447552,PobreOrate,@Bancolombia #FinancieraMente Si el viaje está muy encima y tuve que usar una parte de esos ahorros en algo urgente #BuscaríaEconomía en hospedaje o transporte para esas vacaciones.,2019-05-14 14:02:04+00:00,0,0,#FinancieraMente #BuscaríaEconomía,Puerto López
1127927574481469440,swSALAMANDRAf,Ahora Zipaquira es 1 semana sólo en inscripción y vestuarios de los musicales 1millon... Más hospedaje alimentación gastos no contemplados transportes diarios... NO TENGAN HIJOS!!! Jajajaja ahora sólo tengo tiempo para hacer plata...,2019-05-13 13:24:24+00:00,7,0,,Puerto López
1122373006079217664,gomez_alejo182,Pregunta a los amigos y seguidores de @viajabogota hospedaje en Medellín para la F2R recomiendan algunos ?,2019-04-28 05:32:31+00:00,0,0,,Puerto López
1121393011911462915,mafero__,Alguien que no tenga hospedaje en Santa Marta y necesite para viernes y sábado?,2019-04-25 12:38:23+00:00,7,18,,Puerto López
1121051823702462465,bl4ckallday,La pena me gana!! Pero así y todo he logrado que un uber (que había quitado el sticker para tanquear en una bomba) en algún lugar de Los Angeles nos llevara al hospedaje sin tener cel prendido o valor exacto del trayecto mami no me varo en ningún lado!! pic.twitter.com/iODY4b3Tae,2019-04-24 14:02:37+00:00,0,0,,Puerto López
1121912076941676544,loma_nevada,Con el mejor confort y calidad para tu hospedaje y ahora con los mejores precios hasta el 31 de mayo. Todos los días. Ven a disfrutar de este paraíso idílico. Te esperamos. #lomanevada… https://www.instagram.com/p/BwvIZ07A3bm/?utm_source=ig_twitter_share&igshid=1ktlaofcafqtl …,2019-04-26 23:00:57+00:00,2,2,#lomanevada,Puebloviejo
1120355347473018880,HospedajesCol,Una belleza de hotel ubicado en Taganga - Santa Marta. Hospedaje: JABA NIBUE Foto: Mike Estrada pic.twitter.com/Wen6Ukt6i2,2019-04-22 15:55:04+00:00,0,0,,Puebloviejo
1160256334463418369,JGGP24,Simplemente Maravilloso. 𝕮𝖆𝖇𝖆ñ𝖆𝖘 𝕷𝖊𝖔 🅳🅴🆂🅲🆄🅴🅽🆃🆂 Para Más de 2 Días de Hospedaje. Comunicate y comentanos que lo vistes en @JGGP24 y obten hasta un 15% de Descuento. No te Pierdas esta Promoción. Valida por Este… https://www.instagram.com/p/B0_kn7Bntfv/?igshid=17gypef0iwshx …,2019-08-10 18:27:21+00:00,0,0,,Valencia
1158844650792337408,FRANKYGILEC,Buscando hospedaje en Bogota.... Quien ????,2019-08-06 20:57:49+00:00,0,0,,Valencia
1158147578208432128,jgst681,De esos señores hay bastantes aqui al Hinava venia uno que hasta martillaba pasajes en avion son unos fenómenos se iban de vacaciones a Margarita a martillar a un empresario que tenia un bojote de CH desde pasajes hasta hospedaje chulos,2019-08-04 22:47:54+00:00,0,0,,Valencia
1157780148902662146,CarmenClariana,Es discriminación por su condición sexual eso va en contra de la constitución y el derecho internacional negarle el acceso a una persona al empleo educación entretenimiento hospedaje etc. Por su condición sexual es una violación a sus derechos humanos,2019-08-03 22:27:52+00:00,6,0,,Valencia
1157602879261356032,miradeltigre,Nos empeñamos en que pases unas vacaciones geniales por eso ahora te ofrecemos promociones en la mágica #Merida en el Hotel Los Lirios o en la Posada Chapeta. Promoción familiar para 4 personas. Incluye: Hospedaje… https://www.instagram.com/p/B0suqgdnjZO/?igshid=mubewrx7tl6z …,2019-08-03 10:43:28+00:00,0,0,#Merida,Valencia
1157356851324829696,stviajes1,Plan Travesía express Hotel Milla Suites Mérida. 5 Días 4 Noches 2 Personas. *4 Noches de Hospedaje *Entradas para los 3 Parques Temáticos Los Aleros La Venezuela de Antier La Montaña de los Sueños https://www.instagram.com/p/B0q-0tQFpjm/?igshid=hf2qd3nient5 …,2019-08-02 18:25:50+00:00,0,0,,Valencia
1157297739690065920,hotelpv1,Sin importar el motivo de tu visita siempre somos tu mejor opción en hospedaje. Visítanos y has tus reservas a través de reservacioneslapequenavalencia@gmail.com 02418583688 02418587051 0414-592.42.12 #lapequenavalencia #reuniones #conferencias #familia #espaciointimo#relaxpic.twitter.com/euFxAQIIFE,2019-08-02 14:30:57+00:00,0,0,#lapequenavalencia #reuniones #conferencias #familia #espaciointimo #relaxpic,Valencia
1155264836458225664,eliasmontano,* #LosChulosDeSaoPaulo* $200 millones gastó Maduro para darle a un grupo de chulos comida y hospedaje de lujo mientras aún hay sectores de país sin electricidad. Los niños del JM. De los Ríos no tienen comida y… https://www.instagram.com/p/B0cHe0HpY-N/?igshid=qn75xydgjl6w …,2019-07-27 23:52:55+00:00,0,0,#LosChulosDeSaoPaulo,Valencia
1151887557669662720,abrahamigs,“Estamos cubriéndole alimentación hospedaje y transporte a más de 600 personas en esta #ConvenciónMaranatha” dijo @PastorPaco77 en la conferencia de Liderazgo y Gerencia.pic.twitter.com/3ywamLSbIw,2019-07-18 16:12:49+00:00,5,9,#ConvenciónMaranatha,Valencia
1146127157850189826,CarlosM98001808,...Hola! Carlos Hospedaje Integral. Alquiler de todo tipo de inmuebles Full equipodescuento especial;Coral suite Caribean Suite y Ciudad Flamingo.Paseos cortos y largos por la BELLA y PARADISIACA BAHÍA DEL PARQUE NACIONAL MORROCOY. Full daypeñerolancha o yate. ASESORÍA TOTAL,2019-07-02 18:43:03+00:00,0,0,,Valencia
1141760994873696257,HotelEmperadorV,Ofrecemos desayuno tipo Buffet para nuestros huéspedes quienes hayan solicitado hospedaje con desayuno porque somos un hotel de 3 estrellas con servicio de 4 en la ciudad de Valencia. ... #hotelemperadorv #hotel #valenciavzla #carabobo #venezuela #travel #instatravel #travelingpic.twitter.com/6yU8QRLqiM,2019-06-20 17:33:28+00:00,1,0,#hotelemperadorv #hotel #valenciavzla #carabobo #venezuela #travel #instatravel #travelingpic,Valencia
1140611841791578112,HotelEmperadorV,Cómodas y elegantes habitaciones nos caracteriza como la mejor opción de hospedaje en la ciudad de Valencia. Somos un Hotel de 3 estrellas con servicio de 4. ... #hotelemperadorv #hotel #valenciavzla #carabobo #venezuelapic.twitter.com/65RizXlupP,2019-06-17 13:27:09+00:00,0,0,#hotelemperadorv #hotel #valenciavzla #carabobo #venezuelapic,Valencia
1139195860632424448,termaltrinchera,Estamos activos por Instagram por mensaje directo para dar respuesta a sus inquietudes y reservar su hospedaje en nuestro Hotel. ... #termaltrincheras #hotel #spa #aguastermales #carabobo #venezuelapic.twitter.com/0xcRQIeWu7,2019-06-13 15:40:33+00:00,0,1,#termaltrincheras #hotel #spa #aguastermales #carabobo #venezuelapic,Valencia
1136081606098268160,termaltrinchera,Su salud es importante para nosotros ofrecemos los servicios de salud que necesita con precios aun accesibles en la modalidad todo el día desde las 7:00 am o con hospedaje sin desayuno... #termaltrincheras #hotel #spa #aguastermales #carabobo #venezuela #travelpic.twitter.com/tuYGvnNAYU,2019-06-05 01:25:36+00:00,2,1,#termaltrincheras #hotel #spa #aguastermales #carabobo #venezuela #travelpic,Valencia
1132980166249123841,HotelEmperadorV,Cómodas y elegantes habitaciones nos caracteriza como la mejor opción de hospedaje en la ciudad de Valencia. ... #hotelemperadorv #hotel #valenciavzla #carabobo #venezuelapic.twitter.com/6UYBP23mWc,2019-05-27 12:01:36+00:00,0,0,#hotelemperadorv #hotel #valenciavzla #carabobo #venezuelapic,Valencia
1130197961361825792,jonathan_arrioj,Hola ¿como estas? Quiero compartir contigo los beneficios que tenemos en nuestro Club de Viajes VIVELO!!! con el que puedes disfrutar 4 noches y 5 días de hospedaje gratuito en mas de 15 destinos entre los cuales… https://www.instagram.com/p/BxqAYsEnzjH/?igshid=9qdt5l9qa995 …,2019-05-19 19:46:06+00:00,0,0,,Valencia
1129413168168689664,AntiguaMision,¡Queremos hacer de tus fines de semanas diferente! por lo tanto visítanos y disfruta de nuestros servicios de Hospedaje Piscina y Spa. Todo ello con una asistencia única digna de un Hotel cinco estrellas.… https://www.instagram.com/p/BxkbgT3HAHC/?igshid=jir7v0npoq0k …,2019-05-17 15:47:37+00:00,0,0,,Valencia
1121221955607199747,HotelEmperadorV,Ofrecemos desayuno tipo Buffet para nuestros huéspedes quienes hayan solicitado hospedaje con desayuno porque somos un hotel de 3 estrellas con servicio de 4 en la ciudad de Valencia. ... #hotelemperadorv #hotel #valenciavzla #carabobo #venezuelapic.twitter.com/Xz1B9LYkMO,2019-04-25 01:18:40+00:00,0,0,#hotelemperadorv #hotel #valenciavzla #carabobo #venezuelapic,Valencia
1121054372350386176,lombarditravel,+ Hospedaje noche previa al inicio de la caminata en posada. + Todas las comidas durante el trekking. + Carpa y aislante. + Cocina y cocinero. + Guía. + Porteador para Comida. + Utensilios. + Carpas. + Baño portátil para las caminatas. + Primero Auxilios. + Entrada al Parque.,2019-04-24 14:12:45+00:00,0,0,,Valencia
1142758700958048258,leonard_Raf,Se terminó las vacaciones y quiero agradecerte amigo @postino15daniel y a tu hermosa familia x el hospedaje y la buena onda. Lo quiero y lo mejor de gracias y abrazos diaro8400 en La… https://www.instagram.com/p/BzDQWgmBOrb3vo26xyiZCGH5LWTUs0CnO9bHOQ0/?igshid=ymddtnobe5cx …,2019-06-23 11:38:00+00:00,0,0,,La Libertad
1159942269216022528,comiemx,#RumboAAcapulco2019 - Consulta toda la información sobre el hospedaje y más detalles del congreso en el sitio web: http://congreso.comie.org.mx/ pic.twitter.com/Y92R6vXxip,2019-08-09 21:39:22+00:00,5,4,#RumboAAcapulco2019,Salinas
1159329055751188480,DIEGO_IOB,Me ilusiono muy rápido luego luego busco vuelos hospedaje y pues al final te matan esa ilusión.,2019-08-08 05:02:40+00:00,1,0,,Salinas
1159250273187110913,RinconadaSF,Conoce las tarifas de hospedaje en #Xochitepec ingresa a nuestro sitio: http://www.hotellarinconada.com/instalaciones-hotel-en-xochitepec …pic.twitter.com/2UtwCSPrK6,2019-08-07 23:49:37+00:00,0,0,#Xochitepec,Salinas
1158764135175327749,internatemx,#BuenosDiasATodos obtén un sitio web completo y correos electrónicos al mejor costo-beneficio. Además dominio y Hospedaje por dos años ¡checalo! https://www.internate.mx/promocion-web/ pic.twitter.com/lDNBhOffgO,2019-08-06 15:37:53+00:00,0,0,#BuenosDiasATodos,Salinas
1158616610447527936,Luisgcamposs,Están en GDL la aerolínea no proporciona hospedaje cada pasajero tiene que buscar su propio hospedaje y se les reembolsará pésimo.,2019-08-06 05:51:40+00:00,1,0,,Salinas
1158494089840615427,internatemx,Obtén un Sitio web completo con dos años de Dominio y Hospedaje. Revisa nuestra promoción en https://www.internate.mx/promocion-web/ #paginaweb #ofertas #negocios #promocionespic.twitter.com/KaoEf8SDpP,2019-08-05 21:44:49+00:00,0,0,#paginaweb #ofertas #negocios #promocionespic,Salinas
1158418211722993665,omai_dog,Omai dog! es la mejor opción de hospedaje en estas vacaciones para tu peludo! Contactanos: 5549359072 pic.twitter.com/3VVQqflXtR,2019-08-05 16:43:18+00:00,0,0,,Salinas
1157369348291358720,miguelgp_,Qué tal amigos comuna pregunta realmente sería ¿cuál es la dirección exacta del lugar del festival? Es para efectos de hospedaje viajamos desde la CDMX. Gracias,2019-08-02 19:15:30+00:00,0,0,,Salinas
1154204527198973952,luisgarza2801,Siempre que quiero salir entre semana como hoy recuerdo que una peda de aquí podría ser equivalente a un hospedaje de mi futuro viaje y se me pasa. Mejor me espero al sábado,2019-07-25 01:39:38+00:00,2,0,,Salinas
1151537933188521985,elandrescanalla,Justo le voy a decir que me ayude a armar algo bonito por allá. Total hospedaje ya tengo.,2019-07-17 17:03:32+00:00,1,0,,Salinas
1151505952115478528,JULIOECHONGYONG,Sin dinero público el Comité Olímpico Mexicano ya no dará hospedaje alimento y médicos a deportistas - Proceso https://www.proceso.com.mx/592697/sin-dinero-publico-el-comite-olimpico-mexicano-ya-no-dara-hospedaje-alimento-y-medicos-a-deportistas …,2019-07-17 14:56:27+00:00,1,0,,Salinas
1146093462787362818,jorgealbertole4,Si la policía federal no pagaba ni el hospedaje y en Acapulco algunos hoteles estuvieron a punto de quebrar,2019-07-02 16:29:09+00:00,2,1,,Salinas
1142227859294969857,JoseCarlosVima,No Patricia si hacemos caso yo también hice comentarios con otros tuiteros sobre el tema de la logística hospedaje q no tenían cuarteles o bases precisamente porq estaba programado el lanzamiento de la GN para el 30/junio pero tuvieron que adelantarse por órdenes de Trump.,2019-06-22 00:28:37+00:00,2,0,,Salinas
1135061648727785474,emilio6605,Lo bueno es que hay "austeridad republicana" como para pagar tantos días de hospedaje alimentación logística y etc. etc. etc..... Vaya cinismo la de estos sinvergüenzas de cuarta! https://twitter.com/SergioSarmiento/status/1134872770146373640 …,2019-06-02 05:52:40+00:00,1,0,,Salinas
1130828117306560512,perezmarroquin,@asilascosasw @warkentin @jrisco Buen día no se si ya tocaron el tema del cierre d Turissste al margen d la lamentable pérdida d + d mil empleos k pasara con adeudos millonarios k tiene con hoteleros producto del hospedaje d la gendarmería sea x contrato directo o x terceros,2019-05-21 13:30:07+00:00,0,0,,Salinas
1126888501121835008,vasotequedas,Transporte Redondo Corona Capital GDL nos vamos hoy pasando la media noche  opción a hospedaje también INBOX @CoronaCapitalGD #CoronaCapitalGDLpic.twitter.com/8LqAaQP3ib,2019-05-10 16:35:29+00:00,2,0,#CoronaCapitalGDLpic,Salinas
1126888428740726786,valdoviaggio,Transporte Redondo Corona Capital GDL nos vamos hoy pasando la media noche  opción a hospedaje también INBOX @CoronaCapitalGD #CoronaCapitalGDLpic.twitter.com/C4OEua67kt,2019-05-10 16:35:12+00:00,1,1,#CoronaCapitalGDLpic,Salinas
1126528503237754881,vasotequedas,Transporte redondo al @CCapitalGDL corona Capital Guadalajara desde CDMX últimos espacios con opción a hospedaje y accesos generales salimos viernes pasando la media noche #CoronaCapitalGDL #vasotequedaspic.twitter.com/pEz1s1Kk15,2019-05-09 16:44:59+00:00,2,0,#CoronaCapitalGDL #vasotequedaspic,Salinas
1126528033978974209,valdoviaggio,Últimos espacios para @CoronaCapitalGD transporte redondo desde CDMX con opción a hospedaje ! Salimos viernes pasando la media noche también nos sobran 2 accesos generales 1200 #CoronaCapitaGDL INBOX @Vendo_Boletos @Boletos_CDMX_ @VendoBoletosDFpic.twitter.com/A0uE2Gkr2y,2019-05-09 16:43:07+00:00,2,2,#CoronaCapitaGDL,Salinas
1126155259305394176,valdoviaggio,Aún tenemos espacios para el @CoronaCapitalGD transporte redondo desde CDMX con opción a hospedaje también ! INBOX salimos viernes en la noche #CoronaCapitalGDL @Vendo_Boletos @VentaBoletosMx @Boletos_CDMX_pic.twitter.com/cnEAXQQF0H,2019-05-08 16:01:51+00:00,2,2,#CoronaCapitalGDL,Salinas
1126154884800290816,vasotequedas,Transporte redondo al @CoronaCapitalGD Salimos el Viernes por la noche regreso Domingo! Info INBOX con opción a hospedaje #CoronaCapitalGDL CDMXpic.twitter.com/5Q9etIHwJI,2019-05-08 16:00:22+00:00,1,0,#CoronaCapitalGDL,Salinas
1125526252213948417,valdoviaggio,Recuerden que este sábado iremos al @CoronaCapitalGD Tour incluye: 1 noche de hospedaje transporte redondo Trasladó al evento desayuno y souvenir #CoronaCapitalGuadalajara #vasotequedas #INBOX #RT SALIMOS CDMXpic.twitter.com/cUd6NL9bzs,2019-05-06 22:22:24+00:00,3,1,#CoronaCapitalGuadalajara #vasotequedas #INBOX #RT,Salinas
1125526035892768768,vasotequedas,Recuerden que este sábado iremos al @CoronaCapitalGD Tour incluye: 1 noche de hospedaje transporte redondo Trasladó al evento desayuno y souvenir #CoronaCapitalGuadalajara #vasotequedaspic.twitter.com/DTfh77tEOn,2019-05-06 22:21:32+00:00,0,0,#CoronaCapitalGuadalajara #vasotequedaspic,Salinas
1160266485866147841,CCapellanL,Jajajajajaj yo alquile uno y me rechazaron el hospedaje en ese mismo edificio que iba a pasar el fin de semana con alguien dique por tema de mantenimiento y entonces a los tarjeteros se lo aceptan ditamai,2019-08-10 19:07:41+00:00,0,0,,Santo Domingo
1159573222943313920,Hospedajerd,Gazcue Alquiler apartamento amueblado de tres habitaciones - Inmu...https://do.tuavisoclasificado.com/avisos/ver/id/8451/gazcue-alquiler-apartamento-amueblado-de-tres-habitaciones …,2019-08-08 21:12:54+00:00,1,0,,Santo Domingo
1159572863927640065,Hospedajerd,Venta Apartamento 1 habitacion En Cana Rock Galaxy Punta Cana - In...https://do.tuavisoclasificado.com/avisos/ver/id/7868/venta-apartamento-1-habitacion-en-cana-rock-galaxy-punta-cana …,2019-08-08 21:11:29+00:00,1,0,,Santo Domingo
1157521895740211200,acentodiario,Policía Nacional detiene presunto homicida de persona indigente en Hospedaje Yaqué http://bit.ly/2ywWDsd,2019-08-03 05:21:40+00:00,0,0,,Santo Domingo
1157275566665584640,arecoa_com,#Portada #Hoteles #Destinos Palace Resorts expande su oferta de hospedaje en Punta Cana https://bit.ly/2T79niI @PalaceResorts @MTurismoRD @FJavierGarciaF @ASONAHORES1 @ASOLESTE @PresidenciaRDpic.twitter.com/coOTnan0QG,2019-08-02 13:02:50+00:00,0,0,#Portada #Hoteles #Destinos,Santo Domingo
1126861104796315648,liriano100,La vida no vale nada __-Un tipo identificado cono Danny mató de varias puñaladas a un joven conocido como Wilson en el hospedaje Yaque-- Stgo,2019-05-10 14:46:38+00:00,1,0,,Santo Domingo
1125439129100214272,SergemmaTravel,Hotel|Resort 4 Todo incluido #BeLiveHamacaGarden para hospedaje del 24 al 26 de Mayo 2019 #FinDeSemanaDeLasMadres enBoca Chica TARIFAS POR HABITACIÓN 2 adultos | RD$13750 |… https://www.instagram.com/p/BxIMUbIldR6/?utm_source=ig_twitter_share&igshid=1q09im1s5qvsl …,2019-05-06 16:36:12+00:00,0,0,#BeLiveHamacaGarden #FinDeSemanaDeLasMadres,Santo Domingo
1124112217945673729,SergemmaTravel,Hotel|Resort 4 Todo incluido #BeLiveHamacaGarden para hospedaje del 24 al 26 de Mayo 2019 #FinDeSemanaDeLasMadres enBoca Chica TARIFAS POR HABITACIÓN 2 adultos | RD$13750 |… https://www.instagram.com/p/Bw-w6MEl621/?utm_source=ig_twitter_share&igshid=kemz2ylqjpuc …,2019-05-03 00:43:32+00:00,0,0,#BeLiveHamacaGarden #FinDeSemanaDeLasMadres,Santo Domingo
1123742708386992128,chino_bavaro,Desde RD le damos todo el apoyo que se merecen nuestros Hermanos luchadores Venezolanos a Chile gracias por dar hospedaje a esas personas que quieren un cambio para el pueblo Venezolano.,2019-05-02 00:15:14+00:00,0,0,,Santo Domingo
1120642813123813379,SergemmaTravel,Hotel|Resort todo incluido #HodelpaGardenSuites para hospedaje del 27 al 29 de Abril 2019 #FeriadoDelTrabajador Juan Dolio TARIFAS POR HABITACIÓN 2 adultos | RD$11520| Doble 3… https://www.instagram.com/p/BwmHNfblj8R/?utm_source=ig_twitter_share&igshid=kszpa1t1mrz7 …,2019-04-23 10:57:21+00:00,0,0,#HodelpaGardenSuites #FeriadoDelTrabajador,Santo Domingo
