1157425645586190337,Glatinmusic,¿Existen las coincidencias? Yo creo que sí. En algún lugar del mundo (no Colombia) buscando mi propósito de expansión por un lado y yendo a su lugar de hospedaje temporal por el otro nos hemos encontrado… https://www.instagram.com/p/B0reGxsHmGT/?igshid=1rz6rrwjulz2v …,2019-08-02 22:59:12+00:00,0,0,,Tulcan
1157424185733517312,Glatinmusic,¿Existen las coincidencias? Yo creo que sí. En algún lugar del mundo (no Colombia) buscando mi propósito de expansión por un lado y yendo a su lugar de hospedaje temporal por el otro nos hemos encontrado… https://www.instagram.com/p/B0rdcYOnVIT/?igshid=pm1yb2z0nqho …,2019-08-02 22:53:24+00:00,0,0,,Tulcan
1132752917017112576,MUYMIO,Con Ronald McDonald. Ellos cubren todo. Traslados hospedaje comidas y tratamiento. Revisar en un McDonalds,2019-05-26 20:58:35+00:00,3,1,,Bolivar
1159459589294821378,ARCSA_CZ1,#ArcsaEnMedios | Entrevista en @TVCISNE sobre el operativo realizado en los establecimientos que brindan servicios de hospedaje y los próximos a efectuarse en #Sucumbíospic.twitter.com/wBQ5qEyA8Y,2019-08-08 13:41:22+00:00,14,24,#ArcsaEnMedios #Sucumbíospic,Ibarra
1134811628640362497,ingjfmm,@mario_sabato saludos desde Ibarra la ciudad blanca de Ecuador todos apoyando a Richard y López esperando el movistar tenga el 1 y 2 saludos a ustedes los narradores esperando nos visiten alimentación y hospedaje comas las sorpresas pagadas. pic.twitter.com/tUD2Yzf5v6,2019-06-01 13:19:10+00:00,0,0,,Ibarra
1159506853354758144,HeneciaEcuador,Buen día Henecias! Si alguien que viaja a Perú al concierto de KHJ y aún no dispone de hospedaje envíennos un inbox por favor ya que tenemos lugar en un departamento cercano al concierto!,2019-08-08 16:49:11+00:00,14,5,,Quito
1159446378160017411,KattyMejia11,@Airbnb necesito asesoramiento para mecanismo de cobro por hospedaje temporal,2019-08-08 12:48:52+00:00,0,0,,Quito
1159168036756230144,ABRELATAM,En estos últimos días los donantes que se han hecho cargo de financiar las becas le han enviado correos a las personas que han sido beneficiadas con beca de viaje y/o hospedaje. Les agradecemos a todos su interés y nos apena mucho no haber podido lograr becar mas gente.,2019-08-07 18:22:50+00:00,0,0,,Quito
1159126530125107205,ARCSA_CZ9,#ArcsaTeInforma | Precautelamos la salud de los turistas mediante el control de establecimientos de servicio de hospedaje verificando que cuenten con adecuadas condiciones sanitarias para recibirlos durante el feriado. #Quito #ArcsaTeCuidapic.twitter.com/hXEBbb2Ds2,2019-08-07 15:37:54+00:00,10,16,#ArcsaTeInforma #Quito #ArcsaTeCuidapic,Quito
1158532053840912385,Dianaraquel25ec,Vacaciones en Loja.. que hermoso salir de la ciudad..... Gracias tía por darnos hospedaje...: me siento entusiasmada,2019-08-06 00:15:40+00:00,0,0,,Quito
1158496166801223680,CarlosLbanderas,Y cómo es tu hospedaje cuando cae la noche. Tienes planificado todo?,2019-08-05 21:53:04+00:00,0,0,,Quito
1156733029890609157,CatShantal,Estuvimos con Preciosa en Pluking disfrutando de su hospedaje en Shantal The Cat Clinica Veterinaria #hospedaje #ShihTzu #Veterinaria #ShantalTheCatVet #quito #canino #gatospic.twitter.com/d8NHy02Uks,2019-08-01 01:07:00+00:00,0,0,#hospedaje #ShihTzu #Veterinaria #ShantalTheCatVet #quito #canino #gatospic,Quito
1146944732477710336,jcrpFOTOGRAMA,Presentamos el hospedaje oficial de La Travesía 2019 la mejor carretera del año. Descuentos para los participantes y sus acompañantes. ¡Aprovecha esta gran oportunidad! Más Información: http://www.sisakunalodge.com Email: sisakuna.lodge@gmail.com Tel: (593) 22170343 Mindo-Ecuadorpic.twitter.com/FYNfbcxYlw,2019-07-05 00:51:48+00:00,1,0,,Quito
1144775736953380864,nass_sol,Este fin de semana comparte un delicioso desayuno junto a tu familia en el Mesón Quiteño Restaurante de nuestro #Hotel Nass Sol de #Quito Te esperamos en la Alemania y Vancouver #servicios #lamejorcomida #hospedaje #descanso #familia #findesemana #Ecuadorpic.twitter.com/Re2tYBZ75Q,2019-06-29 01:12:59+00:00,0,0,#Hotel #Quito #servicios #lamejorcomida #hospedaje #descanso #familia #findesemana #Ecuadorpic,Quito
1141136809641930752,nass_sol,Saborea las delicias y #disfruta del buen gusto con la excelencia en #servicios que el Mesón Quiteño Restaurante tiene para ti en nuestro #hotel @nass_sol de #Quito #lamejorcomida #hospedaje #corporativos #negocios #Familia #Ecuadorpic.twitter.com/mGAXHl4xR5,2019-06-19 00:13:11+00:00,0,0,#disfruta #servicios #hotel #Quito #lamejorcomida #hospedaje #corporativos #negocios #Familia #Ecuadorpic,Quito
1140273486503534593,FavioRevelo,Muerte de una vez para que gastar alimentos y hospedaje en escorias de la humanidad https://twitter.com/PedritoExtranja/status/1140045187349176322 …,2019-06-16 15:02:39+00:00,0,0,,Quito
1139972317268840449,rocafuertemax,Q grave abuso d las pseudo agencias d turismo.Reciben grandes cantidades de dinero y luego abandonan a los turistas en países extraños sin responder por pasajesguías alimentación hospedaje. De igual manera procede reiteradamente RITOSTURISA de AITH GOMEZ Q.Q dirá Min.Turismo?,2019-06-15 19:05:54+00:00,3,3,,Quito
1138628588075397120,nass_sol,#hotel @nass_sol de #Quito Solo tienes que hacer tu reserva!!! Te esperamos en la Alemania Nº30-170 y Vancouver Teléf. +593 98 350 6377 #Pareja #Turismo #servicios #lamejorcomida #hospedaje #Ecuadorpic.twitter.com/ZpEZiawmFU,2019-06-12 02:06:24+00:00,0,0,#hotel #Quito #Pareja #Turismo #servicios #lamejorcomida #hospedaje #Ecuadorpic,Quito
1136438717588090880,DavidMantillaR5,"Era deseo mío verme con él era algo sexual. Estuvo claro para él que quería saber cuándo podía ir a verle. Le dije que por mi situación me era imposible en ese momento pero él me comento que podía solucionarlo" comenzó dejando claro que #Neymar pago el viaje y el hospedaje pic.twitter.com/qbyn5NARi3,2019-06-06 01:04:38+00:00,0,0,#Neymar,Quito
1133257924124528640,Marketing_VIP,Papá merece ser tratado como el rey del hogar por eso llévalo a Panamá a un viaje de ensueños con todas las comodidades. Te incluye: Ticket aéreo Hospedaje en ciudad y playa Tours Alimentación… https://www.instagram.com/p/Bx_vuZdApqA/?igshid=1crucf8sdlicw …,2019-05-28 06:25:18+00:00,3,2,,Quito
1132660253282177026,halison_m,Fue una buena experiencia #amigas #familia #primo #photographer #caminata #musica #baile #desmadre #hospedaje #risas #risas y más #risas en Parque La Carolina - Patio De Juegos https://www.instagram.com/p/Bx7gGpDFNy0p5CQixZ3HSb6P7_G1z1BL-ab3eM0/?igshid=2s2jq7g9llpu …,2019-05-26 14:50:22+00:00,0,0,#amigas #familia #primo #photographer #caminata #musica #baile #desmadre #hospedaje #risas #risas #risas,Quito
1131008967700819970,nass_sol,Vive y disfruta con tus seres más queridos en espacios hechos a medida con la mejor calidad de servicio de toda la ciudad. Te esperamos en el #Hotel NASS Sol de #Quito en la Alemania con Vancouver Nº30-170 Teléfs: +593 (02) 2544051/ (02) 2541773 #turismo #familia #hospedaje pic.twitter.com/2EXyuOtgzu,2019-05-22 01:28:45+00:00,0,0,#Hotel #Quito #turismo #familia #hospedaje,Quito
1128469556786270209,nass_sol,En el #hotel NASS Sol de #Quito estamos para servirte como te mereces!!! En esta oportunidad ofrecemos para ti nuestra promoción Acumula Puntos y Gana Noches de Hospedaje Gratis!!!. Estamos encantados de premiar tu fidelidad #servicios #ganapuntos #nochesgratis #corporativospic.twitter.com/miFLmgeLXu,2019-05-15 01:18:02+00:00,0,0,#hotel #Quito #servicios #ganapuntos #nochesgratis #corporativospic,Quito
1126655021028974593,nass_sol,Queremos premiar tu fidelidad! por cada noche que te pernoctes con nosotros te obsequiamos noches de hospedaje con nuestra Promoción de Acumulación de Puntos Estamos en la Alemania N30-170 entre Eloy Alfaro y Vancouver Teléf. +593 98 350 6377 #corporativos #turismo #Quitopic.twitter.com/cmug1dIR1C,2019-05-10 01:07:43+00:00,0,0,#corporativos #turismo #Quitopic,Quito
1126510806776958976,CarCisneros,Finalmente no se les han proporcionado hospedaje o comida por la cancelación?,2019-05-09 15:34:40+00:00,0,0,,Quito
1122670128695578624,nass_sol,En el #Hotel @nass_sol de #Quito nos mueve el valor por el servicio! Nuestro principal objetivo es servirte como te mereces por ello queremos premiar tu fidelidad con la promoción de Acumulación de Puntos. Recibe noches de hospedaje gratis y muchas sorpresas más! #ganapuntospic.twitter.com/khFJsKKmeO,2019-04-29 01:13:11+00:00,1,1,#Hotel #Quito #ganapuntospic,Quito
1121503309410578432,jpvelin,¡Buenas noticias! Se aprobó el reglamento que beneficia a las personas con enfermedades catastróficas y les da el derecho a gozar de servicios de hospedaje transporte alimentación y otros que el ente rector de salud no pueda cubrir. Video completo: https://youtu.be/WoRGpP9YRzY pic.twitter.com/PE1q6xYjSL,2019-04-25 19:56:40+00:00,16,15,,Quito
1120427906633744386,nass_sol,En el #hotel @nass_sol de #Quito nos mueve el valor por el servicio!!! Nuestro principal objetivo es servirte como te mereces por ello queremos premiar tu fidelidad con la Acumulación de Puntos. Recibe noches de hospedaje gratis y muchas sorpresas más! #hospedajegratispic.twitter.com/FFSgeAiZIC,2019-04-22 20:43:24+00:00,1,1,#hotel #Quito #hospedajegratispic,Quito
1160240224913567745,Manuelm77802522,No te creas ese 14% wue no votara por @AbelMartinezD  son puros resentidos..todo porque le ordeno limpiar lo hospedaje donde vendian sus productos como cerdos,2019-08-10 17:23:20+00:00,0,0,,Mejia
1157635700789059585,CibaoCentralPN,Dirección #CibaoCentral @PoliciaRD #SinTregua contra el crímen apresa autor de la muerte de persona indigente en Hospedaje Yaqué #Santiago. Se trata de Wilkins Lebrón De Los Santos (a) Tafito de 35 años. @de_dipre @MinInteriorRDpic.twitter.com/tqKEWsbny2,2019-08-03 12:53:53+00:00,5,3,#CibaoCentral #SinTregua #Santiago,Mejia
1157456955855630337,kpasasantiago,Detienen autor de la muerte de persona indigente en Hospedaje Yaqué http://dlvr.it/R9Zjqr,2019-08-03 01:03:37+00:00,0,0,,Mejia
1157448025838694400,rpalcalde2020,RUBEN POLANCO dice va a desarrabalizar El Hospedaje Yaque. #elcambiova #rpalcalde2020 Ver completo: https://www.youtube.com/watch?v=ne8g3nmOv1s&feature=youtu.be …pic.twitter.com/mv2h98eK7m,2019-08-03 00:28:08+00:00,1,0,#elcambiova #rpalcalde2020,Mejia
1152644540932775942,ElvisJPerez,Y 20 pesos de lechuga y repollo. en El Hospedaje Santiago De Los Caballeros https://www.instagram.com/p/B0Jf6U5DVqpwcYh3Gbgkpc-6BCPFu6lW1bRkEQ0/?igshid=waarctg9p9ws …,2019-07-20 18:20:48+00:00,0,0,,Mejia
1145154043750338561,lockpasoporto,@AlcaldiadeStgo @AbelMartinezD Nos reporta José Manuel Castillo desde el Hospedaje Yaque un basurero inusual favor tomar nota la limpieza de la ciudad es el buque insignia de la actual gestión. @StgoSomosTodos @DJavierTH @MaryRussell1308 @LucienneCarlo @samy_cho #BasuraNopic.twitter.com/hFzaZjUAvg,2019-06-30 02:16:14+00:00,2,4,#BasuraNopic,Mejia
1139010479756627968,ramiritocp,Aqui en el Hospedaje Yaque (Santiago) Mejor conocido "Lo Pedaje " aparece,2019-06-13 03:23:54+00:00,0,0,,Mejia
1122372256917786625,Mariela07839866,No ha logrado buscarle una solución al hospedaje Jaque de Santiago y ahora porque el precandidato a la alcaldía @FernandoRosaRD expreso su interés en solucionarlo él dice que lo va hacer veo que se está quieriendo poner los pantalones muy tarde.,2019-04-28 05:29:33+00:00,0,0,,Mejia
1146648908698796032,fmcifuentesc,Tour "Quilotoa y Baños" 2 días: Sábado 13 y Domingo 14 de julio Incluye: Transporte Turístico Alimentación completa Hospedaje 1 noche Observación de flora fauna y… https://www.instagram.com/p/Bze5aY6J3RbnbnOaVkvkwQhk4fxWdyQ8sMt7cc0/?igshid=16kf4whbe4jlg …,2019-07-04 05:16:18+00:00,0,0,,Latacunga
1143526470935109632,riverpeopleraft,Ven y disfruta de conocer la Amazonía con River People.3 días y 2 noches Todo Incluido. Selva + hospedaje en nuestro Lodge + rafting + comidas. US$195 por persona (IVA no Incluido) pic.twitter.com/WnwiyiD24M,2019-06-25 14:28:51+00:00,0,0,,Latacunga
1157760546285981697,NeftaJaen19PA,Es lo que corresponde según costo de vida en Europa. Hospedaje transporte y alimentación para hacer los cálculos que justifican en la ley del Presupuesto Gral del Estado.,2019-08-03 21:09:59+00:00,0,0,,Ambato
1129039067885260800,Jorgeluisbsc07,Volvió lo q todos esperaban... #PuraPlaya Tour Summerland Montañita '019 Mach & Daddy #EnVivo INCLUYE POR 90$Transporte especializado de turismo Hospedaje 2 noches y 3 días Bebida por cada 4 persona Snack por cada persona Fiesta Concierto Reservas con 10$al 0995828280 pic.twitter.com/k3tRKmygaL,2019-05-16 15:01:04+00:00,1,0,#PuraPlaya #EnVivo,Ambato
1128681344136036352,Macara_Oficial,¡VIAJA CON NOSOTROS! Bolivia Incluye: Todos los traslados del aeropuerto-hotel-estadio. Hospedaje City Tour por la ciudad de Santa Cruz de la Sierra. Salida: 19 de mayo-Retorno: 22 de mayo. Valor: $800 USD Aceptamos efectivo y tarjetas de crédito. #YoCreoEnTiMacarápic.twitter.com/bcJZpwtlfv,2019-05-15 15:19:36+00:00,51,17,#YoCreoEnTiMacarápic,Ambato
1158944847585316864,Alexrivaden1895,Alguien que me preste una cuenta Paypal yo me encargo de que depositarle y descuenten mi dinero? La mía se pudrió por intentar reservar tickets aéreos y necesito pagar hospedaje mas otros gastos :(,2019-08-07 03:35:58+00:00,0,0,,Guaranda
1152943395884752899,serviplatinium,HOSPEDAJE EN GUAYAQUIL CASA AMOBLADA POR DÍAS CON PISCINA tf: (+593)0994795665 Cotización y reservas directas TF:0994795665 link en facebook… https://www.instagram.com/p/B0LnztvHxDZ/?igshid=1povj86ljwomq …,2019-07-21 14:08:20+00:00,0,0,,Chillanes
1146832646502326272,serviplatinium,HOSPEDAJE EN GUAYAQUIL CASA AMOBLADA POR DÍAS CON PISCINA tf: (+593)0994795665 Cotización y reservas directas TF:0994795665 link en facebook… https://www.instagram.com/p/BzgM9nBn0vk/?igshid=zvnq6b0ocyoi …,2019-07-04 17:26:24+00:00,2,0,,Chillanes
1143529064554258432,serviplatinium,HOSPEDAJE EN GUAYAQUIL CASA AMOBLADA POR DÍAS CON PISCINA tf: (+593)0994795665 Cotización y reservas directas TF:0994795665 link en facebook… https://www.instagram.com/p/BzIuqr1nWbO/?igshid=mncvjjtqbbv1 …,2019-06-25 14:39:09+00:00,1,0,,Chillanes
1138508584604426240,serviplatinium,Nueva imagen : hospedaje en Guayaquil  sábanas y toallas importadas 100 % algodón para confort de nuestros clientes  veladores y cabeceras nuevas  renovando para brindarles lo mejor.a su llegada al hospedaje en… https://www.instagram.com/p/BtuqGxXhkM0/?igshid=npwzp79575ap …,2019-06-11 18:09:33+00:00,0,0,,Chillanes
1134818579482890241,serviplatinium,HOSPEDAJE EN GUAYAQUIL CASA AMOBLADA POR DÍAS CON PISCINA tf: (+593)0994795665 Cotización y reservas directas TF:0994795665 link en facebook… https://www.instagram.com/p/ByK1j1GHZvY/?igshid=3y0xipkphonw …,2019-06-01 13:46:47+00:00,0,0,,Chillanes
1128698937756532736,DelSolSuites,Hospedaje en apartamentos amoblados en Guayaquil. Informacion al 0991868228 en http://Cdla.la Garzota https://www.instagram.com/p/BxfWtjggQ7T/?utm_source=ig_twitter_share&igshid=11zitfpv5o4y0 …,2019-05-15 16:29:31+00:00,0,0,,Chillanes
1128344069283958784,serviplatinium,HOSPEDAJE EN GUAYAQUIL CASA AMOBLADA POR DÍAS CON PISCINA tf: (+593)0994795665 Cotización y reservas directas TF:0994795665 link en facebook… https://www.instagram.com/p/Bxc0jI-HbEl/?utm_source=ig_twitter_share&igshid=1op498us3gkx7 …,2019-05-14 16:59:24+00:00,1,0,,Chillanes
1125554386359521286,serviplatinium,Serviplatinium Rent_A_House Hospedaje Alojamiento En Guayaquil - Guayas - Ecuador Casa Amoblada Guayas vía Samborondon km 10.5 Urbanizacion Marinado'r Park mz 18 Urb. la Marina Samborondón (04) 506-1151 https://maps.app.goo.gl/816xnj2XKN2XMXj8A …,2019-05-07 00:14:12+00:00,0,0,,Chillanes
1125542568924733440,VALKYRIAMJ,Holiiiiiiii !!!! #AquiCasual mi feriado en Hospedaje del Pacífico el mejor lugar en todo puerto Engabao !!! . . . #PicOfTheDay #LifeStyle #Instagramermood #InstaPick #InstaLike… https://www.instagram.com/p/BxI7W_-FiMV/?utm_source=ig_twitter_share&igshid=r2t0tttketmv …,2019-05-06 23:27:14+00:00,1,0,#AquiCasual #PicOfTheDay #LifeStyle #Instagramermood #InstaPick #InstaLike,Chillanes
1124482397599223808,DelSolSuites,Hospedaje o alquiler en apartamentos amoblados. Informes al 0991868228 en http://Cdla.la Garzota https://www.instagram.com/p/BxBZQE7gwZ0/?utm_source=ig_twitter_share&igshid=11pq7bdhyvcou …,2019-05-04 01:14:30+00:00,0,0,,Chillanes
1124006629060632576,serviplatinium,HOSPEDAJE EN GUAYAQUIL CASA AMOBLADA POR DÍAS CON PISCINA tf: (+593)0994795665 Cotización y reservas directas TF:0994795665 link en facebook… https://www.instagram.com/p/Bw-A5E8Bg-N/?utm_source=ig_twitter_share&igshid=1fqf1gfyscw7j …,2019-05-02 17:43:58+00:00,1,0,,Chillanes
1123013739848978432,mascotayalgomas,ESTE FERIADO TRABAJAMOS NORMALMENTE. Ya nos quedan pocos cupos de hospedaje para sus engreídos. Reservas al Telf.: 0980034935. en Mascotas Y Algo Más https://www.instagram.com/p/Bw29YfrF8vd/?utm_source=ig_twitter_share&igshid=174vou5tsyg0y …,2019-04-29 23:58:34+00:00,0,0,,Chillanes
1122179508965203968,DelSolSuites,Hospedaje o alquiler en apartamentos amoblados en Guayaquil. Informacion al 0991868228 en http://Cdla.la Garzota https://www.instagram.com/p/BwxCBTUgSxz/?utm_source=ig_twitter_share&igshid=1h4u5soh7vhbi …,2019-04-27 16:43:38+00:00,0,0,,Chillanes
1121034409056956417,mascotayalgomas,Keiky ya de regreso a casa luego de 15 días dr hospedaje. en Mascotas Y Algo Más https://www.instagram.com/p/Bwo5SiBlW1A/?utm_source=ig_twitter_share&igshid=1n8b84vyu2ewk …,2019-04-24 12:53:25+00:00,0,0,,Chillanes
1159509945064275973,bancatlan,Durante tus vacaciones en @TelamarResort recibirás lujo diversión comodidad y un 40%* de descuento en tarifa todo incluido y solo hospedaje al pagar con tus #TarjetasDeCréditoAtlántida. http://bit.ly/2ZD2EiN Reserva llamando al 2480-4300 *Aplican restriccionespic.twitter.com/SWrZxILM56,2019-08-08 17:01:28+00:00,2,0,#TarjetasDeCréditoAtlántida,Chimbo
1157058544908349440,domusaureaec,Realiza tu evento en Domus Aurea y GANA entradas a las exclusivas piscinas de LUNA VOLCAN ó el hospedaje en nuestra hosteria afiliada. Para más información: 0999076322 / 0995508302 Facebook: https://www.facebook.com/domusaureaec/ pic.twitter.com/mWujpQHa2l,2019-08-01 22:40:28+00:00,0,0,,Riobamba
1159842516834721792,mariobosqu,Pana los manes iban en una delegación a un evento oficial todo pagado por la Conmebol. Cuando ellos estén en sus días libres y pagándose sus viaticos y hospedaje con su plata están en todo el derecho. Por algo son “profesionales” no futbolistas de barrio o aficionados,2019-08-09 15:02:59+00:00,1,0,,Chunchi
1159552392934952960,CamaraCanadiens,Aproveche las tarifas preferenciales en hospedaje y salones de Eventos que los Hoteles afiliados con nosotros ofrecen a los #SOCIOSCCECG. Contactos: socios@ecuacangye.com / 04 2630828pic.twitter.com/Qg85nxHBDx,2019-08-08 19:50:08+00:00,0,0,#SOCIOSCCECG,Chunchi
1159534755039404032,Yo_StoneCold,...hace eso? Y por no invadir ese carril a mi primo lo choco atras un auto fue leve y mas rapido que mandrake llegaron los atm que argumentan? La grua pagar nostros y carisimo el auto al canchon y pagarles el hospedaje 5 estrellas al auto y encima pagar la sancion por el...,2019-08-08 18:40:03+00:00,0,0,,Chunchi
1158796860745760768,Arcsa_Ec,#ArcsaTeCuida | En #BañosDeAguaSanta y #Guayaquil técnicos de #Arcsa realizan visitas en establecimientos de hospedaje para verificar las condiciones higiénico-sanitarias y el cumplimiento de la normativa vigente. pic.twitter.com/x8SzATmlm9,2019-08-06 17:47:55+00:00,44,89,#ArcsaTeCuida #BañosDeAguaSanta #Guayaquil #Arcsa,Chunchi
1158782473188384768,ARCSA_CZ8,#ArcsaTeInforma | Socializamos con propietarios y encargados de servicios de hospedaje y turismo sobre las observaciones levantadas durante la inspección. #ArcsaTeCuidapic.twitter.com/ZxrkojzrPL,2019-08-06 16:50:45+00:00,5,10,#ArcsaTeInforma #ArcsaTeCuidapic,Chunchi
1158775666269216768,ARCSA_CZ8,#ArcsaTeInforma | Verificamos mantenimiento de equipos de lavado de lencería en servicios de hospedaje y turismo en la ciudad de #Guayaquil . #ArcsaTeCuidapic.twitter.com/yoQFARRaYD,2019-08-06 16:23:42+00:00,4,9,#ArcsaTeInforma #Guayaquil #ArcsaTeCuidapic,Chunchi
1158773870679212033,Arcsa_Ec,#ArcsaTeCuida | Técnicos de #Arcsa realizan operativo de control en establecimientos que ofrecen servicios de hospedaje en #SantaElena y #Crucita previo al feriado.pic.twitter.com/BJU5ICtV5p,2019-08-06 16:16:34+00:00,50,96,#ArcsaTeCuida #Arcsa #SantaElena #Crucita,Chunchi
1158772538694148097,ARCSA_CZ8,#ArcsaTeInforma | Socializamos con los colaboradores de servicios de hospedaje y turismo la importancia de los procedimientos y registros de limpieza. #ArcsaTeCuidapic.twitter.com/aKnbZWKcEw,2019-08-06 16:11:16+00:00,3,8,#ArcsaTeInforma #ArcsaTeCuidapic,Chunchi
1158770658215682049,ARCSA_CZ8,#ArcsaTeInforma | Verificamos la limpieza de los utensilios donde se almacenan los alimentos que se sirven en el Buffet de restaurantes en servicios de hospedaje. #ArcsaTeCuidapic.twitter.com/JIERSnhMgz,2019-08-06 16:03:48+00:00,3,8,#ArcsaTeInforma #ArcsaTeCuidapic,Chunchi
1158764712861011969,ARCSA_CZ8,#ArcsaTeInforma | Personal técnico de #Arcsa y @MinturZonal5 verifican el cumplimiento de la normativa vigente para servicios de hospedaje que funcionan en el centro de #Guayaquil . #ArcsaTeCuidapic.twitter.com/cKgorXTW7V,2019-08-06 15:40:11+00:00,6,12,#ArcsaTeInforma #Arcsa #Guayaquil #ArcsaTeCuidapic,Chunchi
1158763892614598656,ARCSA_CZ8,#ArcsaTeInforma | Verificamos limpieza e higiene en habitaciones de servicios de hospedaje que funcionan en el centro de la ciudad de #Guayaquil . #ArcsaTeCuidapic.twitter.com/GQzsv6auCd,2019-08-06 15:36:55+00:00,3,10,#ArcsaTeInforma #Guayaquil #ArcsaTeCuidapic,Chunchi
1158762522746507267,ARCSA_CZ8,#ArcsaTeInforma | Personal técnico de #Arcsa verifica limpieza de estanterías y almacenamiento de materias primas en restaurantes que funcionan dentro de establecimientos de turismo y hospedaje. #ArcsaTeCuidapic.twitter.com/lQPFkYkKRq,2019-08-06 15:31:28+00:00,13,18,#ArcsaTeInforma #Arcsa #ArcsaTeCuidapic,Chunchi
1158761688138731520,Black1411,Agrego que el año pasado Emelec aparecía en el SRI con una deuda por más de 3 Millones de dólares. Al terminar el año 2018 salía cero deudas. Más pago a empleados del club mantenimiento del estadio gastos por concentración traslados hospedaje alimentación etc etc,2019-08-06 15:28:09+00:00,4,2,,Chunchi
1158759669709582337,ARCSA_CZ8,#ArcsaTeInforma | En operativo junto a @MinturZonal5 verificamos condiciones higiénicas en servicios de turismo y hospedaje del centro de #Guayaquil. #ArcsaTeCuidapic.twitter.com/HwPl78nZHX,2019-08-06 15:20:08+00:00,7,12,#ArcsaTeInforma #Guayaquil #ArcsaTeCuidapic,Chunchi
1158188664394047488,DiscoverCIT,A la hora de viajar el principal pensamiento del turista es verificar cual será el destino de su hospedaje. Es importante que un hotel pueda ofrecerte servicios de calidad que sean innovadores y una perfecta… https://www.instagram.com/p/B0w4-eWAxbf/?igshid=o30l0s297y7 …,2019-08-05 01:31:10+00:00,1,0,,Chunchi
1157340311661809664,CamaraCanadiens,Aproveche las tarifas preferenciales en hospedaje y salones de Eventos que los Hoteles afiliados con nosotros ofrecen a los #SOCIOSCCECG. Contactos: socios@ecuacangye.com / 04 2630828pic.twitter.com/Xq79nDttTW,2019-08-02 17:20:07+00:00,1,0,#SOCIOSCCECG,Chunchi
1157085618062659584,EcPeloteros,Carlos Córdova en #Peloteros: Ya se está arreglando el tema de hospedaje la movilización todo lo concerniente a Angulo. Aunque faltan definir temas como el salario del jugador,2019-08-02 00:28:03+00:00,0,1,#Peloteros,Chunchi
1151198146640449537,GuanitoursEC,PANAMÁ - CIUDAD •Viaja HASTA 23 de diciembre •3 noches •Desde $629 por persona en hab. triple •Vigencia sujeta a disponibilidad INCLUYE: Ticket aéreo vía COPA AIRLINES Traslados Hospedaje APLICAN… https://www.instagram.com/p/Bz_OKw8lFG7/?igshid=1uhwma3n2x5d …,2019-07-16 18:33:21+00:00,0,0,,Chunchi
1149780526581944320,GuanitoursEC,SANTIAGO+VIÑA+VALPARAISO! •Desde $396 por persona en hab. triple •4-3 INCLUYE: Traslados Desayunos diarios Tours Hospedaje NO INCLUYE: Boleto aéreo APLICAN… https://www.instagram.com/p/Bz1Jgojgnls/?igshid=rbz9lqikluan …,2019-07-12 20:40:14+00:00,1,0,,Chunchi
1145362705190129664,VALKYRIAMJ,Otro día más de pesca... En Hospedaje del Pacifico!!! Por cierto un lugar recomendado para un fin de semana de descanso en la playa #Tbt #Thinkinbig #AventuraExtrema #playa #Pesca #Caña #carrete #Pacifico… https://www.instagram.com/p/BzVwg-4g2Hz/?igshid=102t4q8afxpvx …,2019-06-30 16:05:23+00:00,0,0,#Tbt #Thinkinbig #AventuraExtrema #playa #Pesca #Caña #carrete #Pacifico,Chunchi
1138301889840214017,ElChemarcelo_ec,Por el día del Padre !!! Desde este martes 11 de junio hasta el domingo 16 de junio. Haremos un sorteo donde daremos como premio un hospedaje para 2 personas por un fin de semana en hosteriabellavistaplayas con… https://www.instagram.com/p/ByjloQeA_Z-/?igshid=1q797whalzax7 …,2019-06-11 04:28:13+00:00,0,0,,Chunchi
1131583448525631489,DelSolSuites,Hospedaje en apartamentos amoblados. Informes al 0991868228 en Ecuador Guayaquil https://www.instagram.com/p/Bxz2bxwpqL4/?igshid=1dkv5s8wyvg0o …,2019-05-23 15:31:32+00:00,0,0,,Chunchi
1136457374409998336,ChuzaLongaHome,Huespedes felices!!! Así es como se sienten cuando visitan nuestra Casa de Hospedaje en Chuza Longa Home https://www.instagram.com/p/ByWe1tehcNP/?igshid=cq7ta02f2xg0 …,2019-06-06 02:18:47+00:00,0,0,,Colta
1159960152012939269,CooperativaJEP,En este feriado paga tus consumos de gastronomía viajes hospedaje y mucho más con #TarjetasJEP. Aprovecha los descuentos y promociones exclusivas.,2019-08-09 22:50:25+00:00,8,1,#TarjetasJEP,Azogues
