1144008000610414592,PUNTAHILLS,Montañita & La Ruta del Sol ... Viviiilaaaa en Hills . . Reserva Hospedaje Tours & Fiestas al 0991776618 . #puntahillsmontanita #hotel #tours #beachtime #rutadelspondylus #surf en Punta Hills Montanita https://www.instagram.com/p/BzMIdqsHu3Z/?igshid=zk3l25upbe2p …,2019-06-26 22:22:16+00:00,0,0,#puntahillsmontanita #hotel #tours #beachtime #rutadelspondylus #surf,Daule
1143515346831384583,PUNTAHILLS,Tus Vacaciones Soñadas ... Pack Vacacional 3 Días 2 Noches Hospedaje Tour ruta del sol Clase de Surf Concierto el sábado Fiesta en la Noche Valor x Persona $55.00 (+5 personas ) . Reserva al… https://www.instagram.com/p/BzIobfRHKwG/?igshid=1cx3v4jvwddnk …,2019-06-25 13:44:38+00:00,0,0,,Daule
1143150336422621185,PUNTAHILLS,Momentos ... #befree #behills ... . Reserva Hospedaje - Tours - Fiesta - Cenas al 0991776618 . #puntahillsmontanita #hotel #magicplace #montañita #beachtime #ecuador en Punta Hills Montanita https://www.instagram.com/p/BzGCcOpn5vG/?igshid=15upcvka8o4bs …,2019-06-24 13:34:13+00:00,1,2,#befree #behills #puntahillsmontanita #hotel #magicplace #montañita #beachtime #ecuador,Daule
1141878618144018433,PUNTAHILLS,Y sal de GuayaKill un rato ... Ven y aprovecha la Promo de Hills .. 2 Días y 1 Noche Hospedaje DESAYUNO INCLUIDO Tour de Ballenas En Habitaciones : 5 a más Personas $42.00 pp En dobles $60.00 pp Reserva al… https://www.instagram.com/p/By9AIb-Hv1f/?igshid=146j0rw3lud10 …,2019-06-21 01:20:52+00:00,1,1,,Daule
1141783071215292417,PUNTAHILLS,LLEGARON LAS BALLENAS! Convierte tus vacaciones en una experiencia MEMORABLE  . Buscas aventura en lugares mágicos? . . TENEMOS LO QUE NECESITAS! . . Comodidad en el hospedaje con desayuno buffett y.. VISTA AL… https://www.instagram.com/p/By8Urrcn0m2/?igshid=c08etomyf8d8 …,2019-06-20 19:01:12+00:00,0,0,,Daule
1140628640834707456,PUNTAHILLS,Este Verano vivilo en Hills . . Hospedaje - Tours - Fiestas . Reserva al 0991776618 . #puntahillsmontanita #hotel #beachtime #tours #rutadelspondylus #verano #ecuador en Montañita Ecuador https://www.instagram.com/p/By0HtYSH4L_/?igshid=ok0b9jrun043 …,2019-06-17 14:33:54+00:00,0,0,#puntahillsmontanita #hotel #beachtime #tours #rutadelspondylus #verano #ecuador,Daule
1139898196161777664,PUNTAHILLS,DÍA DEL PADRE en Hills .. Hospedaje - Cenas Reserva y Disfruta de este día con nosotros . Recepción: 0991776618 . #puntahillsmontanita #montañita #Love #díadelpadre #sabado #junio en Punta Hills Montanita https://www.instagram.com/p/Byu7iUCnUgg/?igshid=2zip6m7dvpcn …,2019-06-15 14:11:22+00:00,0,0,#puntahillsmontanita #montañita #Love #díadelpadre #sabado #junio,Daule
1138413954101850112,PUNTAHILLS,PROMOCION este Fin de Semana Por el Día del PADRE Habitaciones Grupales con vista al Mar (4 personas o más ) 3 Días 2 Noches ^Hospedaje Desayuno Concierto de Reggae Valor $25 x persona total . 2 Días 1 Noche ^… https://www.instagram.com/p/BykYlaInFvV/?igshid=owo8a13e6wlp …,2019-06-11 11:53:32+00:00,0,0,,Daule
1138289114539798528,PUNTAHILLS,Matrinomios Hospedaje  recepción  comidas coctelería  Shows y Banda de música .. Personal de respaldo y arreglos adicionales . Información: 0991776618 . Celébralo en Hills . #montañita #wedding… https://www.instagram.com/p/Byjf0GLnKJv/?igshid=ubi81uzo5l11 …,2019-06-11 03:37:27+00:00,0,0,#montañita #wedding,Daule
1137766709526433792,PUNTAHILLS,Simplemente Punta Hills Montañita.. . Reserva al 0991776618 Hospedaje Tours Fiesta Show y cenas . #puntahillsmontanita #hotel #tours #fiesta #bestplacestogo #montañita #ecuador en Montañita Ecuador https://www.instagram.com/p/ByfyQOEH2_S/?igshid=120slm0fj6jz7 …,2019-06-09 17:01:36+00:00,0,0,#puntahillsmontanita #hotel #tours #fiesta #bestplacestogo #montañita #ecuador,Daule
1137045885806817280,PUNTAHILLS,Las mejores Vacaciones en Montañita .. Pack Estudiantil - Hospedaje (grupales) - Desayunos - Almuerzos y Cenas - Tours y Actividades - Fiesta Capacidad 120 Personas . Reserva al 0991776618 . #beachtime… https://www.instagram.com/p/ByaqdTrhV5n/?igshid=xh6wacucfzff …,2019-06-07 17:17:19+00:00,0,0,#beachtime,Daule
1133113663693479937,PUNTAHILLS,Celébralo en Hills .. Promoción Cumpleaños Incluye : Hospedaje ( 6-12 personas ) Desayuno Fiesta Torta de cumple Cóctel Valor x Persona $19.00 . Promoción Parejas Hospedaje Desayuno y Cena . . Reserva… https://www.instagram.com/p/Bx-uSw5HT2s/?igshid=gmwcurq5ur4e …,2019-05-27 20:52:04+00:00,0,1,,Daule
1132862024470355968,PUNTAHILLS,The Whales are coming ... Pack Aventura x Pareja 3 días 2 Noches Hospedaje Desayunos Cena Show Tour de Ballenas Concierto de Reggae el Sábado . . Vive toda la Experiencia Hills . Reserva al 0991776618… https://www.instagram.com/p/Bx873BhHZSh/?igshid=cay04hpjt35i …,2019-05-27 04:12:08+00:00,1,0,,Daule
1131203762364866560,PUNTAHILLS,Todo te ofrecemos en Hills ... Hospedaje Fiesta Concierto y Djs Tours en la Ruta . . Reserva al 0991776618 / 0992169613 . . #Feriado #mayo #montañita #hotel #diversión #puntahillsparadise #beach #concierto… https://www.instagram.com/p/BxxJxXXH8Wz/?igshid=zh3mkjej8qoo …,2019-05-22 14:22:48+00:00,0,0,#Feriado #mayo #montañita #hotel #diversión #puntahillsparadise #beach #concierto,Daule
1130845916288626689,PUNTAHILLS,El Sol sigue en La Ruta del Sol .. Y los #puntahillstours están increíbles.. Reserva este Feriado Hospedaje y Tours .. Información: 0991776618 / 0992169613 . . . #montañita #sunset #turismo #hothothot… https://www.instagram.com/p/BxunCg4nZB7/?igshid=1srpzwj9huahh …,2019-05-21 14:40:51+00:00,0,0,#puntahillstours #montañita #sunset #turismo #hothothot,Daule
1129555788345860097,PUNTAHILLS,Montañita y sus maravillas ... Descúbrela con nosotros .. Hospedaje - Tours - Fiestas ... Reserva al 0991776618 . . . #beautifuldestinations #puntahillsparadise #montañita #hotel #mayo #bluesky #music en Punta… https://www.instagram.com/p/BxlcW5oH8fG/?igshid=smqajrxtzttm …,2019-05-18 01:14:20+00:00,0,0,#beautifuldestinations #puntahillsparadise #montañita #hotel #mayo #bluesky #music,Daule
1127928507785334789,PUNTAHILLS,Montañita ... Habitaciones Libres este Fds ... Mantenemos la Promoción del Cumpleaños ... Hospedaje  Fiesta  Cóctel y Torta ... Reserva al 0991776618 #puntahillsparadise #hotel… https://www.instagram.com/p/BxZ4Wt4nmWT/?utm_source=ig_twitter_share&igshid=nn6ew45ca10i …,2019-05-13 13:28:06+00:00,0,0,#puntahillsparadise #hotel,Daule
1126923762694217728,PUNTAHILLS,Por que la mami se merece unas vacaciones .... Ven a Punta Hills ... Pack Hospedaje Deaayuno y Cena incluida ... Reserva al 0991776618 #diadelamadre2019 #vistaalmar #montañita #hotel… https://www.instagram.com/p/BxSvc6jnUlQ/?utm_source=ig_twitter_share&igshid=14zizibtoqf7 …,2019-05-10 18:55:36+00:00,0,0,#diadelamadre2019 #vistaalmar #montañita #hotel,Daule
1159843367376658432,Ave_Fenix_200,Siiii...linda...no muy grande...con cabañita aparte para que sirva para hospedaje de migrantes por un tiempo... un sueño...que se te haga realidad...,2019-08-09 15:06:22+00:00,1,0,,El Empalme
1156618635177267205,PanaTVec,1/2 AÚN TENEMOS CUPOS 73 y 4 de Agosto Chanduy Santa Elena Desde los 8 años adolescentes y jóvenes COSTO: $1900 (Incluye Hospedaje y alimentación) SI ERES MENOR DE EDAD: Solo necesitamos una autorización firmada por padres de familia. pic.twitter.com/R5d6CDT2Il,2019-07-31 17:32:26+00:00,3,1,,El Triunfo
1154219482593804288,hostelnucapacha,Si tenemos vacantes si. Sino podemos hacer un intercambio con hospedaje,2019-07-25 02:39:03+00:00,0,0,,Naranjal
1153028070217080832,serviplatinium,Serviplatinium Rent_A_House Hospedaje Alojamiento En Guayaquil - Guayas - Ecuador Casa Amoblada Guayas vía Samborondon km 10.5 Urbanizacion Marinado'r Park mz 18 Urb. la Marina Samborondón (04) 506-1151 https://maps.google.com/?cid=18390680761085800221 …,2019-07-21 19:44:48+00:00,0,0,,Naranjal
1152773687461986304,serviplatinium,Hospedaje en Guayaquil #hospedajeenguayaquilhttps://abnb.me/44A8YNw5oY,2019-07-21 02:53:59+00:00,0,0,#hospedajeenguayaquilhttps,Naranjal
1151988596062035971,serviplatinium,Hospedaje en Guayaquil https://abnb.me/Br2V9aqWdY,2019-07-18 22:54:18+00:00,0,0,,Naranjal
1151712717574721542,after_my,#TweetSerio. Estoy buscando a alguien que este alquilando y este dispuesta en compartir hospedaje... #Guayaquil,2019-07-18 04:38:04+00:00,0,0,#TweetSerio #Guayaquil,Naranjal
1151566711155503105,serviplatinium,Hospedaje en Guayaquil reservas al tf : 0994795665 https://abnb.me/44A8YNw5oY,2019-07-17 18:57:53+00:00,0,0,,Naranjal
1150032245962543105,Walterick,Se les quite el plan celular y hospedaje y que lo paguen con su sueldo como cualquier ciudadano ecuatoriano.,2019-07-13 13:20:28+00:00,1,0,,Naranjal
1149132781651484675,serviplatinium,Hospedaje en Guayaquil https://abnb.me/Br2V9aqWdY,2019-07-11 01:46:19+00:00,0,0,,Naranjal
1149117370297933824,oswaldob26,Además reciben como $150 diarios de viáticos cuando tienen hospedaje alimentación e implementos.,2019-07-11 00:45:05+00:00,0,0,,Naranjal
1146796612087373824,serviplatinium,Serviplatinium Rent_A_House Hospedaje Alojamiento En Guayaquil - Guayas - Ecuador Casa Amoblada Guayas vía Samborondon km 10.5 Urbanizacion Marinado'r Park mz 18 Urb. la Marina Samborondón (04) 506-1151 https://maps.app.goo.gl/816xnj2XKN2XMXj8A …,2019-07-04 15:03:13+00:00,1,0,,Naranjal
1145732997674610688,serviplatinium,Hospedaje en Guayaquil https://abnb.me/lJ7UAE0mYX,2019-07-01 16:36:47+00:00,1,0,,Naranjal
1143921582685007872,serviplatinium,Serviplatinium Rent_A_House Hospedaje Alojamiento En Guayaquil - Guayas - Ecuador Casa Amoblada Guayas vía Samborondon km 10.5 Urbanizacion Marinado'r Park mz 18 Urb. la Marina Samborondón (04) 506-1151 https://maps.app.goo.gl/816xnj2XKN2XMXj8A …,2019-06-26 16:38:53+00:00,1,0,,Naranjal
1142799613939855361,serviplatinium,Hospedaje en Guayaquil https://abnb.me/pdTwUnBzIX,2019-06-23 14:20:34+00:00,1,0,,Naranjal
1142283916679831552,serviplatinium,Hospedaje en Guayaquil reservas aqui https://abnb.me/pdTwUnBzIX,2019-06-22 04:11:23+00:00,1,0,,Naranjal
1139958919000989696,serviplatinium,Serviplatinium Rent_A_House Hospedaje Alojamiento En Guayaquil - Guayas - Ecuador Casa Amoblada Guayas vía Samborondon km 10.5 Urbanizacion Marinado'r Park mz 18 Urb. la Marina Samborondón (04) 506-1151 https://maps.app.goo.gl/816xnj2XKN2XMXj8A …,2019-06-15 18:12:40+00:00,1,0,,Naranjal
1137920539157323776,serviplatinium,Serviplatinium Rent_A_House Hospedaje Alojamiento En Guayaquil - Guayas - Ecuador Casa Amoblada Guayas vía Samborondon km 10.5 Urbanizacion Marinado'r Park mz 18 Urb. la Marina Samborondón (04) 506-1151 https://maps.app.goo.gl/816xnj2XKN2XMXj8A …,2019-06-10 03:12:52+00:00,1,0,,Naranjal
1137033401851158528,serviplatinium,Hospedaje en Guayaquil tf : +593-994795665 #hospedajeenguayaquil #hospedaje https://abnb.me/1oUkktAwkX,2019-06-07 16:27:42+00:00,0,0,#hospedajeenguayaquil #hospedaje,Naranjal
1132742594956541953,GLOSS_193,Esperemos que esto si suceda y estas personas puedan ayudar a otras ARMY’s que necesitan hospedaje pero primero @BigHitEnt ya confirma más fechas @BTS_twthttps://twitter.com/1Chimin/status/1132453251033509888 …,2019-05-26 20:17:34+00:00,3,1,,Naranjal
1130307720614174720,serviplatinium,Hospedaje en Guayaquil https://abnb.me/x2ywb5PIPW,2019-05-20 03:02:15+00:00,0,0,,Naranjal
1129879976701059073,JorgeRojasCr,¿Qué seguridad jurídica hay por dar servicio de hospedaje en internet o tienen mis clientes de que un "Fiscal" pida allanar servidores alquilados a una empresa para poder brindar servicios informáticos? Todos los que estudiamos informática estamos jodidos #FreeOlaBini #InaPapershttps://twitter.com/FiscaliaEcuador/status/1129574042195963904 …,2019-05-18 22:42:33+00:00,391,308,#FreeOlaBini #InaPapershttps,Naranjal
1129382951702192128,serviplatinium,HOSPEDAJE en Guayaquil reservas tf +593-0994795665 https://abnb.me/IFWS3ncuLW,2019-05-17 13:47:33+00:00,0,0,,Naranjal
1125152525718564865,serviplatinium,Hospedaje en Guayaquil casa amoblada https://abnb.me/JXGREiW6rW,2019-05-05 21:37:21+00:00,0,0,,Naranjal
1120739881465069568,serviplatinium,Hospedaje en Guayaquil reservas aquí #hospedaje https://abnb.me/kfKJCZUT7V,2019-04-23 17:23:04+00:00,0,0,#hospedaje,Naranjal
1159504543085785088,Gx2Viajes,Incluye: Vuelo en viaje redondo saliendo desde #Querétaro equipaje documentado traslados aeropuerto - hotel - aeropuerto y hospedaje en plan Todo Incluido (Hotel Cancun Bay Resort) Pregunta por más fechas y… https://www.instagram.com/p/B06PeoyJdTw/?igshid=1i0ika3bkgmjk …,2019-08-08 16:40:00+00:00,0,0,#Querétaro,Salitre
1151673134807838721,doctorsimulacro,El Comité Olímpico Mexicano ya no dará hospedaje alimento y médicos a deportistas por falta de la falta de presupuesto. pic.twitter.com/IK4fj1mWC6,2019-07-18 02:00:47+00:00,0,0,,Salitre
1147237988969005056,paradorvernal,¡Sorprende a tu pareja con una cena romántica¡ Etiqueta a la persona que te debe una cena así Pregunta por nuestro paquete con hospedaje. Info vía inbox o al 4412964058 http://www.paradorvernal.com.mx #turismoderomance #cenaromantica #bernal #pueblomagicopic.twitter.com/LueCTVJOd2,2019-07-05 20:17:05+00:00,1,1,#turismoderomance #cenaromantica #bernal #pueblomagicopic,Salitre
1135953743541874689,gsrdzl,Pongo como ejemplo mis casos. Yo he salido solo 2 veces al extranjero con cargo al erario. La primera fue un viaje a España siendo becario. Con dinero público se pagó mi vuelo y un viaje en tren. El hospedaje lo pagó la Universidad huésped y lo demás lo pagué yo.,2019-06-04 16:57:32+00:00,2,0,,Salitre
1135710352212209664,paumari_maga,Tu querrías Ir? 3000 pesos hospedaje y transporte a 5 minutos de la playa,2019-06-04 00:50:23+00:00,0,0,,Salitre
1134452211608576000,Norberto_Gro,Para muestra ésta foto una figura wixarika hecha por un artesano al que él le da hospedaje en la clínica. La foto la tomé cuando salí de su consulta cómo dos horas después de que llegué,2019-05-31 13:30:59+00:00,1,0,,Salitre
1133816190869094403,ADNQro,#NoTeLoPierdas Inauguran segunda Casa del Estudiante de Tequisquiapan en la capital la cual alberga a 10 alumnas. En este espacio se les dará hospedaje alimentación acceso a servicios básicos e internet http://bit.ly/30SEhP9 pic.twitter.com/shgQvLqDpf,2019-05-29 19:23:39+00:00,1,1,#NoTeLoPierdas,Salitre
1131950480744222720,ADNQro,#Deportes ¡Real Madrid niega petición de Pochettino sobre hospedaje en Valdebebas! El DT del Tottenham acusó a Florentino Pérez de negarle a su equipo el uso de esas instalaciones para alojarse los días previos a la final de #Champions. http://bit.ly/30EpmrX pic.twitter.com/3hjTMw5cwB,2019-05-24 15:49:59+00:00,0,0,#Deportes #Champions,Salitre
1129897345074679813,SaulDLP,No mame chofi le pague pasaje no hospedaje ya píseleeee,2019-05-18 23:51:34+00:00,1,0,,Salitre
1128858419610279936,aQamador,Alguien quiere un par de boletos de avión de Leon a Puerto Vallarta y el hospedaje en airbnb? Estoy en el hospital y al parecer ya no iré! Sale a las el jueves 16-may 8:30 am regresando el 19-may a las 12pm. :( pic.twitter.com/YszfoYTcdB – at ISSSTE Hospital General,2019-05-16 03:03:15+00:00,0,0,,Salitre
1128839715266936832,anntego,Acá les dejo una opción de hospedaje a toda ésa afición del @ClubAmerica digna de ustedes los llamados "azulcremas" De nada...!!! pic.twitter.com/UL4awadXLG,2019-05-16 01:48:55+00:00,4,0,,Salitre
1127612667995271168,marctronico,#MeUrgeTropico además llueven guapos ahí. Espero este año si conseguir hospedaje en el hotel cede y no hasta el princess.,2019-05-12 16:33:04+00:00,1,0,#MeUrgeTropico,Salitre
1158031232451719169,Kintekgt,FELICITACIONES A TODOS!!! ● Pills Band ( 1er lugar ) Brazalete para guardar medicamentos ● Huesped Canino ( 2do. lugar) Hospedaje canino ●Café y Más ( 3er. Lugar ) #RoadToInnovateEscuintla #EmprendedoresEscuintlapic.twitter.com/tAUW3bifqQ,2019-08-04 15:05:35+00:00,1,0,#RoadToInnovateEscuintla #EmprendedoresEscuintlapic,Santa Lucía
1157708468540923905,Haestrada18,Donde verdad se quiere profesionalizar el futbol de Gt @fedefut_oficial debería definir los requisitos mínimos para participar en LN: viajes en vehículos adecuados hospedaje antes o después de ciertas distancias horarios de juego calidad de instalaciones para equipos,2019-08-03 17:43:02+00:00,2,0,,Santa Lucía
1132752917017112576,MUYMIO,Con Ronald McDonald. Ellos cubren todo. Traslados hospedaje comidas y tratamiento. Revisar en un McDonalds,2019-05-26 20:58:35+00:00,3,1,,Bolívar
1157305606597939200,bocabeach1,BOCA BEACH. BARRESTAURANTEEVENTOSHOSPEDAJE. https://www.facebook.com/732510285/posts/10156116000115286/ …,2019-08-02 15:02:12+00:00,0,0,,Chone
1146648908698796032,fmcifuentesc,Tour "Quilotoa y Baños" 2 días: Sábado 13 y Domingo 14 de julio Incluye: Transporte Turístico Alimentación completa Hospedaje 1 noche Observación de flora fauna y… https://www.instagram.com/p/Bze5aY6J3RbnbnOaVkvkwQhk4fxWdyQ8sMt7cc0/?igshid=16kf4whbe4jlg …,2019-07-04 05:16:18+00:00,0,0,,Chone
1132380176896155651,MileydiGil,Mi lugar de hospedaje en Chalán-Sucre . #PuraMaderapic.twitter.com/1IoNIlNfqy,2019-05-25 20:17:27+00:00,15,0,#PuraMaderapic,El Carmen
1159597668030668805,revistademanabi,Controlan higiene de hospedaje y alimentación turísticos http://revistademanabi.com/2019/08/08/controlan-higiene-de-hospedaje-y-alimentacion-turisticos/ …pic.twitter.com/uBpkjRUhd3,2019-08-08 22:50:02+00:00,1,0,,Jaramijó
1159146268251369473,SCRealtyCorp1,Se acerca otro feriado y ya sabes que #Manta es el lugar ideal para pasarlo. Hermosas #playas la mejor #gastronomía y una #vidanocturna que te dejará deseando más. Averigua sobre nuestras opciones de hospedaje antes que se agoten. CALL +593 96 875 1147 #FeriadoEnMantapic.twitter.com/CG0drr9lOi,2019-08-07 16:56:20+00:00,0,0,#Manta #playas #gastronomía #vidanocturna #FeriadoEnMantapic,Jaramijó
1159212999703519239,Luisanacbn1,Le presté el depto a Mili para que venga a estudiar unos días. Acabo de llegar y está todo limpio/ordenado hizo arreglar una pérdida de agua hay comida y encima me dejó plata por el “hospedaje”. Hay muchas cosas que hago mal pero de amigos me elegí a las mejores personas.,2019-08-07 21:21:30+00:00,98,0,,Junín
1160198486471528454,Cargismun,@Bancolombia #FinancieraMente Si el viaje está muy encima y tuve que usar una parte de esos ahorros en algo urgente #BuscaríaEconomía en hospedaje o transporte para esas vacaciones.,2019-08-10 14:37:29+00:00,0,0,#FinancieraMente #BuscaríaEconomía,Puerto López
1160176000799580161,carlosmojica,Ahorra dinero viajando por el mundo y Colombia con el hospedaje más económico del mercado https://abnb.me/e/ayFoqtdw2Y,2019-08-10 13:08:08+00:00,0,0,,Puerto López
1159525814129627136,EuriCaraballo,@Bancolombia #FinancieraMente Si el viaje está muy encima y tuve que usar una parte de esos ahorros en algo urgente #BuscaríaEconomía en hospedaje o transporte para esas vacaciones.,2019-08-08 18:04:31+00:00,0,0,#FinancieraMente #BuscaríaEconomía,Puerto López
1157449682852962304,elmopri27,Vuelo yopal-Bogotá que estaba para las 6:43pm lo han dejado para las 9pm y las bellezas mascaverga de @Avianca @AviancaEscucha @sicsuper @PesimoServicio no responden por los pasajeros ni alimentación ni buena comunicación ni hospedaje para los de conexión,2019-08-03 00:34:43+00:00,0,0,,Puerto López
1156193927629815808,laorem60,Que estaba RETIRADA DE LA POLÍTICA! De el partido liberal/farc U.P que no le daba hospedaje a los narcotraficantes de las FARC etc.. Traidora. Igual de mentirosa a Petro.. https://twitter.com/EspinosaRadio/status/1156149736824610816 …pic.twitter.com/dH6wERS6zq,2019-07-30 13:24:48+00:00,1,0,,Puerto López
1155847047238606849,paulalsnzz,Esto pasa cuando no sabes que ir a Tomorrowland es más que tener la entrada también gastas en tiquetes comida hospedaje y demás... https://twitter.com/loperajuanca/status/1155505349262225411 …,2019-07-29 14:26:25+00:00,0,0,,Puerto López
1153491560237019136,lufe1323,Hps venezolanos llegan a morder la mano de los que les dan de comer no es posible que uno de amable les dé hospedaje alimentación y trabajo y esos malparidos lleguen a robar y dañar todo en una casa,2019-07-23 02:26:33+00:00,0,0,,Puerto López
1151124219637436416,hotelviappal,El mejor propósito para hoy es ser Feliz y hacer Feliz a los demás. Un excelente martes les desea su Hotel Vía Principal. su mejor opción de hospedaje en Villavicencio. pic.twitter.com/uNehBsSh5q,2019-07-16 13:39:35+00:00,0,0,,Puerto López
1150826049787351041,alkaravan,De este hospedaje Residencias Berlin Granada sacaron muchas personas y las desaparecían Antiguo DAS y paracos juntos móviles principalmente robarles dinero y pertenencias. pic.twitter.com/7CJxm44Zwv,2019-07-15 17:54:46+00:00,1,3,,Puerto López
1150549950184468482,Yotenyuco,Llegate que te quieres llegar chamita :s hospedaje y alimentación y cariñitos no te van a faltar,2019-07-14 23:37:38+00:00,0,0,,Puerto López
1149304951795007488,hotelviappal,Aprendamos a valorar el presente porque desde el se construye el futuro. Feliz Jueves les desea su Hotel Vía Principal su mejor opción de hospedaje en Villavicencio. pic.twitter.com/rFX2VyC6qL,2019-07-11 13:10:28+00:00,0,0,,Puerto López
1148587728621199363,hotelviappal,Sonrían hoy es un día excelente para empezar a sentirnos orgullosos de ser quienes somos. Feliz martes les desea su Hotel Vía Principal su mejor opción de hospedaje en Villavicencio. pic.twitter.com/OHkxhTorUt,2019-07-09 13:40:28+00:00,0,0,,Puerto López
1147700204445011968,Kalumontilla,Tiquetes: Check! Hospedaje: Check! Listo el primer viaje con novio!,2019-07-07 02:53:46+00:00,4,0,,Puerto López
1146815251771510784,MigracionCol,Oficiales de @MigracionCol capacitan sobre el uso de la plataforma #SIRE a los establecimientos que prestan el servicio de alojamiento y hospedaje en el municipio de Chinácota en #NorteDeSantander #SomosMigraciónpic.twitter.com/g6wUoCJwe4,2019-07-04 16:17:17+00:00,6,0,#SIRE #NorteDeSantander #SomosMigraciónpic,Puerto López
1143933907160764416,AmandaDiazP,Kayak o skyscanner te dan la opción de ver en semáforo los costos de los vuelos y amo a http://Booking.com para buscar hospedaje. Despegar me parece más costoso que los demás. Por eso armo mis propios paquetes,2019-06-26 17:27:51+00:00,2,0,,Puerto López
1143329832010428416,Lccf66,Todo ese tiempo por fuera y consiguen 15 becas! Jajjajajajajajajajajajajjajajajajajajajajjajajajajajajajajajajsjajsjjsjsjsjajajajajajajajjaajjajajaj No seamos tan maricas! Sumen todos los tiqueteshospedaje y viáticos de esa comisión y salen 100 becas sin ir a pasear por allá!,2019-06-25 01:27:28+00:00,0,0,,Puerto López
1141091924771819521,MaLejaDiaz12,¿Quién me da hospedaje en Cgena?,2019-06-18 21:14:49+00:00,1,0,,Puerto López
1140576818753343488,guason1985,@LATAM_CHI Me cancelaron el vuelo para Cartagena de India 17/06 sin ninguna explicación. Y ahora tengo q resolver?? Y el hospedaje quien responde??,2019-06-17 11:07:59+00:00,0,0,,Puerto López
1139198585453592579,Ingeniebrita,Yo: Los hoteles son muy caros. La gente: Busca Airbnb que te sale mejor. Yo: Buscando... Un hospedaje: Te cuesta más la limpieza del apto que la misma noche Yo: Será que si le digo q yo le dejo el apto limpio me lo deja más barato. Jajaja me pasan unas vainas. pic.twitter.com/CdBfmhRNXD,2019-06-13 15:51:22+00:00,3,0,,Puerto López
1139158963449159682,Ingeniebrita,Ustedes como hacen pa viajar tanto y tan seguido a Miami juepuchaaaaaaa el hospedaje es Puchaaaamente carooooooo yo pensaba que NYC era costoso pero mirando Miami lo es también.,2019-06-13 13:13:56+00:00,15,1,,Puerto López
1137399458885513217,MigracionCol,Oficiales de @MigracionCol realizaron labores de verificación migratoria en establecimientos comerciales y lugares de hospedaje de extranjeros en el municipio de Chía. #SomosMigraciónpic.twitter.com/B98o6JoXOW,2019-06-08 16:42:17+00:00,5,2,#SomosMigraciónpic,Puerto López
1135171492365385729,CamiloPrietoVal,Hay algo más que tenemos los humanos. Tal vez lo que nos confiere espacio neuronal para la racionalidad también da hospedaje a la maldad.,2019-06-02 13:09:08+00:00,0,0,,Puerto López
1134911791899783168,PoliciaMeta,#ConstruyendoSeguridad En Puerto López #Meta con @ProteccionPonal realizamos actividades de control al Registro Nacional de Turismo de los establecimientos de alojamiento y hospedaje para garantizar un #TurismoSeguro.pic.twitter.com/zxurYvHRfJ,2019-06-01 19:57:11+00:00,5,5,#ConstruyendoSeguridad #Meta #TurismoSeguro,Puerto López
1133479757826482177,MigracionCol,Dentro de la estrategia #GEM Oficiales de @MigracionCol @PoliciaColombia y la Secretaría de Salud de Neiva adelantan labores de verificación en sitios de hospedaje en el centro y aledaños al malecón en la capital del Huila #SomosMigraciónpic.twitter.com/UaI5Y2HSZr,2019-05-28 21:06:47+00:00,6,1,#GEM #SomosMigraciónpic,Puerto López
1133377775019151360,luka_manrique,#Soyunserdeluz faltó Zunga @CaritoAgudelo hojaldra homosapiens Honor honra hostal hospedaje hongos @CaroCarreta,2019-05-28 14:21:33+00:00,0,0,#Soyunserdeluz,Puerto López
1132004295233232898,MigracionCol,En Chía nuestros Oficiales de @MigracionCol realizaron actividades de verificación en establecimientos comerciales y lugares de hospedaje de extranjeros. Toda la información sobre trámites y requisitos migratorios se encuentra en http://www.migracioncolombia.gov.co pic.twitter.com/8mCziR1fcB,2019-05-24 19:23:50+00:00,8,0,,Puerto López
