1144601255253303296,ChrisgLDU,Cabañas #OASIS lo mejor en hospedaje en estas #Vacaciones en #Súa - #Esmeraldas tu #Hotel en #Ecuador y viaja por #transesmeraldas pic.twitter.com/x4oDMcYGgh,2019-06-28 13:39:39+00:00,0,0,#OASIS #Vacaciones #Súa #Esmeraldas #Hotel #Ecuador #transesmeraldas,Atacames
1160264693023420417,Arcsa_Ec,Cuando viajes anticipa tu hospedaje y planifica tu recorrido por tu seguridad y la de tu familia. #ViajaSeguroEcpic.twitter.com/FgFpzHaR5N,2019-08-10 19:00:34+00:00,0,0,#ViajaSeguroEcpic,Eloy Alfaro
1159842516834721792,mariobosqu,Pana los manes iban en una delegación a un evento oficial todo pagado por la Conmebol. Cuando ellos estén en sus días libres y pagándose sus viaticos y hospedaje con su plata están en todo el derecho. Por algo son “profesionales” no futbolistas de barrio o aficionados,2019-08-09 15:02:59+00:00,1,0,,Eloy Alfaro
1159552392934952960,CamaraCanadiens,Aproveche las tarifas preferenciales en hospedaje y salones de Eventos que los Hoteles afiliados con nosotros ofrecen a los #SOCIOSCCECG. Contactos: socios@ecuacangye.com / 04 2630828pic.twitter.com/Qg85nxHBDx,2019-08-08 19:50:08+00:00,0,0,#SOCIOSCCECG,Eloy Alfaro
1159534755039404032,Yo_StoneCold,...hace eso? Y por no invadir ese carril a mi primo lo choco atras un auto fue leve y mas rapido que mandrake llegaron los atm que argumentan? La grua pagar nostros y carisimo el auto al canchon y pagarles el hospedaje 5 estrellas al auto y encima pagar la sancion por el...,2019-08-08 18:40:03+00:00,0,0,,Eloy Alfaro
1158796860745760768,Arcsa_Ec,#ArcsaTeCuida | En #BañosDeAguaSanta y #Guayaquil técnicos de #Arcsa realizan visitas en establecimientos de hospedaje para verificar las condiciones higiénico-sanitarias y el cumplimiento de la normativa vigente. pic.twitter.com/x8SzATmlm9,2019-08-06 17:47:55+00:00,44,89,#ArcsaTeCuida #BañosDeAguaSanta #Guayaquil #Arcsa,Eloy Alfaro
1158782473188384768,ARCSA_CZ8,#ArcsaTeInforma | Socializamos con propietarios y encargados de servicios de hospedaje y turismo sobre las observaciones levantadas durante la inspección. #ArcsaTeCuidapic.twitter.com/ZxrkojzrPL,2019-08-06 16:50:45+00:00,5,10,#ArcsaTeInforma #ArcsaTeCuidapic,Eloy Alfaro
1158775666269216768,ARCSA_CZ8,#ArcsaTeInforma | Verificamos mantenimiento de equipos de lavado de lencería en servicios de hospedaje y turismo en la ciudad de #Guayaquil . #ArcsaTeCuidapic.twitter.com/yoQFARRaYD,2019-08-06 16:23:42+00:00,4,9,#ArcsaTeInforma #Guayaquil #ArcsaTeCuidapic,Eloy Alfaro
1158773870679212033,Arcsa_Ec,#ArcsaTeCuida | Técnicos de #Arcsa realizan operativo de control en establecimientos que ofrecen servicios de hospedaje en #SantaElena y #Crucita previo al feriado.pic.twitter.com/BJU5ICtV5p,2019-08-06 16:16:34+00:00,50,96,#ArcsaTeCuida #Arcsa #SantaElena #Crucita,Eloy Alfaro
1158772538694148097,ARCSA_CZ8,#ArcsaTeInforma | Socializamos con los colaboradores de servicios de hospedaje y turismo la importancia de los procedimientos y registros de limpieza. #ArcsaTeCuidapic.twitter.com/aKnbZWKcEw,2019-08-06 16:11:16+00:00,3,8,#ArcsaTeInforma #ArcsaTeCuidapic,Eloy Alfaro
1158770658215682049,ARCSA_CZ8,#ArcsaTeInforma | Verificamos la limpieza de los utensilios donde se almacenan los alimentos que se sirven en el Buffet de restaurantes en servicios de hospedaje. #ArcsaTeCuidapic.twitter.com/JIERSnhMgz,2019-08-06 16:03:48+00:00,3,8,#ArcsaTeInforma #ArcsaTeCuidapic,Eloy Alfaro
1158764712861011969,ARCSA_CZ8,#ArcsaTeInforma | Personal técnico de #Arcsa y @MinturZonal5 verifican el cumplimiento de la normativa vigente para servicios de hospedaje que funcionan en el centro de #Guayaquil . #ArcsaTeCuidapic.twitter.com/cKgorXTW7V,2019-08-06 15:40:11+00:00,6,12,#ArcsaTeInforma #Arcsa #Guayaquil #ArcsaTeCuidapic,Eloy Alfaro
1158763892614598656,ARCSA_CZ8,#ArcsaTeInforma | Verificamos limpieza e higiene en habitaciones de servicios de hospedaje que funcionan en el centro de la ciudad de #Guayaquil . #ArcsaTeCuidapic.twitter.com/GQzsv6auCd,2019-08-06 15:36:55+00:00,3,10,#ArcsaTeInforma #Guayaquil #ArcsaTeCuidapic,Eloy Alfaro
1158762522746507267,ARCSA_CZ8,#ArcsaTeInforma | Personal técnico de #Arcsa verifica limpieza de estanterías y almacenamiento de materias primas en restaurantes que funcionan dentro de establecimientos de turismo y hospedaje. #ArcsaTeCuidapic.twitter.com/lQPFkYkKRq,2019-08-06 15:31:28+00:00,13,18,#ArcsaTeInforma #Arcsa #ArcsaTeCuidapic,Eloy Alfaro
1158761688138731520,Black1411,Agrego que el año pasado Emelec aparecía en el SRI con una deuda por más de 3 Millones de dólares. Al terminar el año 2018 salía cero deudas. Más pago a empleados del club mantenimiento del estadio gastos por concentración traslados hospedaje alimentación etc etc,2019-08-06 15:28:09+00:00,4,2,,Eloy Alfaro
1158759669709582337,ARCSA_CZ8,#ArcsaTeInforma | En operativo junto a @MinturZonal5 verificamos condiciones higiénicas en servicios de turismo y hospedaje del centro de #Guayaquil. #ArcsaTeCuidapic.twitter.com/HwPl78nZHX,2019-08-06 15:20:08+00:00,7,12,#ArcsaTeInforma #Guayaquil #ArcsaTeCuidapic,Eloy Alfaro
1158188664394047488,DiscoverCIT,A la hora de viajar el principal pensamiento del turista es verificar cual será el destino de su hospedaje. Es importante que un hotel pueda ofrecerte servicios de calidad que sean innovadores y una perfecta… https://www.instagram.com/p/B0w4-eWAxbf/?igshid=o30l0s297y7 …,2019-08-05 01:31:10+00:00,1,0,,Eloy Alfaro
1157340311661809664,CamaraCanadiens,Aproveche las tarifas preferenciales en hospedaje y salones de Eventos que los Hoteles afiliados con nosotros ofrecen a los #SOCIOSCCECG. Contactos: socios@ecuacangye.com / 04 2630828pic.twitter.com/Xq79nDttTW,2019-08-02 17:20:07+00:00,1,0,#SOCIOSCCECG,Eloy Alfaro
1157085618062659584,EcPeloteros,Carlos Córdova en #Peloteros: Ya se está arreglando el tema de hospedaje la movilización todo lo concerniente a Angulo. Aunque faltan definir temas como el salario del jugador,2019-08-02 00:28:03+00:00,0,1,#Peloteros,Eloy Alfaro
1152943395884752899,serviplatinium,HOSPEDAJE EN GUAYAQUIL CASA AMOBLADA POR DÍAS CON PISCINA tf: (+593)0994795665 Cotización y reservas directas TF:0994795665 link en facebook… https://www.instagram.com/p/B0LnztvHxDZ/?igshid=1povj86ljwomq …,2019-07-21 14:08:20+00:00,0,0,,Eloy Alfaro
1151198146640449537,GuanitoursEC,PANAMÁ - CIUDAD •Viaja HASTA 23 de diciembre •3 noches •Desde $629 por persona en hab. triple •Vigencia sujeta a disponibilidad INCLUYE: Ticket aéreo vía COPA AIRLINES Traslados Hospedaje APLICAN… https://www.instagram.com/p/Bz_OKw8lFG7/?igshid=1uhwma3n2x5d …,2019-07-16 18:33:21+00:00,0,0,,Eloy Alfaro
1149780526581944320,GuanitoursEC,SANTIAGO+VIÑA+VALPARAISO! •Desde $396 por persona en hab. triple •4-3 INCLUYE: Traslados Desayunos diarios Tours Hospedaje NO INCLUYE: Boleto aéreo APLICAN… https://www.instagram.com/p/Bz1Jgojgnls/?igshid=rbz9lqikluan …,2019-07-12 20:40:14+00:00,1,0,,Eloy Alfaro
1146832646502326272,serviplatinium,HOSPEDAJE EN GUAYAQUIL CASA AMOBLADA POR DÍAS CON PISCINA tf: (+593)0994795665 Cotización y reservas directas TF:0994795665 link en facebook… https://www.instagram.com/p/BzgM9nBn0vk/?igshid=zvnq6b0ocyoi …,2019-07-04 17:26:24+00:00,2,0,,Eloy Alfaro
1145362705190129664,VALKYRIAMJ,Otro día más de pesca... En Hospedaje del Pacifico!!! Por cierto un lugar recomendado para un fin de semana de descanso en la playa #Tbt #Thinkinbig #AventuraExtrema #playa #Pesca #Caña #carrete #Pacifico… https://www.instagram.com/p/BzVwg-4g2Hz/?igshid=102t4q8afxpvx …,2019-06-30 16:05:23+00:00,0,0,#Tbt #Thinkinbig #AventuraExtrema #playa #Pesca #Caña #carrete #Pacifico,Eloy Alfaro
1143529064554258432,serviplatinium,HOSPEDAJE EN GUAYAQUIL CASA AMOBLADA POR DÍAS CON PISCINA tf: (+593)0994795665 Cotización y reservas directas TF:0994795665 link en facebook… https://www.instagram.com/p/BzIuqr1nWbO/?igshid=mncvjjtqbbv1 …,2019-06-25 14:39:09+00:00,1,0,,Eloy Alfaro
1138508584604426240,serviplatinium,Nueva imagen : hospedaje en Guayaquil  sábanas y toallas importadas 100 % algodón para confort de nuestros clientes  veladores y cabeceras nuevas  renovando para brindarles lo mejor.a su llegada al hospedaje en… https://www.instagram.com/p/BtuqGxXhkM0/?igshid=npwzp79575ap …,2019-06-11 18:09:33+00:00,0,0,,Eloy Alfaro
1138301889840214017,ElChemarcelo_ec,Por el día del Padre !!! Desde este martes 11 de junio hasta el domingo 16 de junio. Haremos un sorteo donde daremos como premio un hospedaje para 2 personas por un fin de semana en hosteriabellavistaplayas con… https://www.instagram.com/p/ByjloQeA_Z-/?igshid=1q797whalzax7 …,2019-06-11 04:28:13+00:00,0,0,,Eloy Alfaro
1134818579482890241,serviplatinium,HOSPEDAJE EN GUAYAQUIL CASA AMOBLADA POR DÍAS CON PISCINA tf: (+593)0994795665 Cotización y reservas directas TF:0994795665 link en facebook… https://www.instagram.com/p/ByK1j1GHZvY/?igshid=3y0xipkphonw …,2019-06-01 13:46:47+00:00,0,0,,Eloy Alfaro
1131583448525631489,DelSolSuites,Hospedaje en apartamentos amoblados. Informes al 0991868228 en Ecuador Guayaquil https://www.instagram.com/p/Bxz2bxwpqL4/?igshid=1dkv5s8wyvg0o …,2019-05-23 15:31:32+00:00,0,0,,Eloy Alfaro
1128698937756532736,DelSolSuites,Hospedaje en apartamentos amoblados en Guayaquil. Informacion al 0991868228 en http://Cdla.la Garzota https://www.instagram.com/p/BxfWtjggQ7T/?utm_source=ig_twitter_share&igshid=11zitfpv5o4y0 …,2019-05-15 16:29:31+00:00,0,0,,Eloy Alfaro
1128344069283958784,serviplatinium,HOSPEDAJE EN GUAYAQUIL CASA AMOBLADA POR DÍAS CON PISCINA tf: (+593)0994795665 Cotización y reservas directas TF:0994795665 link en facebook… https://www.instagram.com/p/Bxc0jI-HbEl/?utm_source=ig_twitter_share&igshid=1op498us3gkx7 …,2019-05-14 16:59:24+00:00,1,0,,Eloy Alfaro
1125554386359521286,serviplatinium,Serviplatinium Rent_A_House Hospedaje Alojamiento En Guayaquil - Guayas - Ecuador Casa Amoblada Guayas vía Samborondon km 10.5 Urbanizacion Marinado'r Park mz 18 Urb. la Marina Samborondón (04) 506-1151 https://maps.app.goo.gl/816xnj2XKN2XMXj8A …,2019-05-07 00:14:12+00:00,0,0,,Eloy Alfaro
1125542568924733440,VALKYRIAMJ,Holiiiiiiii !!!! #AquiCasual mi feriado en Hospedaje del Pacífico el mejor lugar en todo puerto Engabao !!! . . . #PicOfTheDay #LifeStyle #Instagramermood #InstaPick #InstaLike… https://www.instagram.com/p/BxI7W_-FiMV/?utm_source=ig_twitter_share&igshid=r2t0tttketmv …,2019-05-06 23:27:14+00:00,1,0,#AquiCasual #PicOfTheDay #LifeStyle #Instagramermood #InstaPick #InstaLike,Eloy Alfaro
1124482397599223808,DelSolSuites,Hospedaje o alquiler en apartamentos amoblados. Informes al 0991868228 en http://Cdla.la Garzota https://www.instagram.com/p/BxBZQE7gwZ0/?utm_source=ig_twitter_share&igshid=11pq7bdhyvcou …,2019-05-04 01:14:30+00:00,0,0,,Eloy Alfaro
1124006629060632576,serviplatinium,HOSPEDAJE EN GUAYAQUIL CASA AMOBLADA POR DÍAS CON PISCINA tf: (+593)0994795665 Cotización y reservas directas TF:0994795665 link en facebook… https://www.instagram.com/p/Bw-A5E8Bg-N/?utm_source=ig_twitter_share&igshid=1fqf1gfyscw7j …,2019-05-02 17:43:58+00:00,1,0,,Eloy Alfaro
1123013739848978432,mascotayalgomas,ESTE FERIADO TRABAJAMOS NORMALMENTE. Ya nos quedan pocos cupos de hospedaje para sus engreídos. Reservas al Telf.: 0980034935. en Mascotas Y Algo Más https://www.instagram.com/p/Bw29YfrF8vd/?utm_source=ig_twitter_share&igshid=174vou5tsyg0y …,2019-04-29 23:58:34+00:00,0,0,,Eloy Alfaro
1122179508965203968,DelSolSuites,Hospedaje o alquiler en apartamentos amoblados en Guayaquil. Informacion al 0991868228 en http://Cdla.la Garzota https://www.instagram.com/p/BwxCBTUgSxz/?utm_source=ig_twitter_share&igshid=1h4u5soh7vhbi …,2019-04-27 16:43:38+00:00,0,0,,Eloy Alfaro
1121034409056956417,mascotayalgomas,Keiky ya de regreso a casa luego de 15 días dr hospedaje. en Mascotas Y Algo Más https://www.instagram.com/p/Bwo5SiBlW1A/?utm_source=ig_twitter_share&igshid=1n8b84vyu2ewk …,2019-04-24 12:53:25+00:00,0,0,,Eloy Alfaro
1148333012796547073,PuntaPacificoOK,PUNTA PACÍFICO BUNGALOWjS MÁNCORA - Lunes 8 de Julio del 2019 - 14:00" hrs. Un resúmen de nuestro Hospedaje con cerca de 29 grados centígrados a pesar de estar en invierno. Nuestra Página Web:… https://www.instagram.com/p/Bzq2IaRHumJ/?igshid=g9eyn8a3rf6f …,2019-07-08 20:48:19+00:00,0,0,,El Guabo
1146485351403401217,PuntaPacificoOK,Máncora. Perú hoy miércoles 3 julio 2019 a las 06:30hrs. Se ve ya claro y sol radiante a pesar de estar en invierno. Se observa el acceso a la playa. Nuestro Hospedaje entrando a la mano izquierda. Buena época para… https://www.instagram.com/p/Bzdrr-enA-W/?igshid=1gwf90lcxuy1r …,2019-07-03 18:26:23+00:00,0,0,,El Guabo
1146484994212319232,PuntaPacificoOK,Máncora. Perú hoy miércoles 3 julio 2019 a las 06:30hrs. Se ve ya claro y sol radiante a pesar de estar en invierno. Se observa el acceso a la playa. Nuestro Hospedaje entrando a la mano izquierda. Buena época para… https://www.instagram.com/p/Bzdrr-enA-W/?igshid=rq91r4orppes …,2019-07-03 18:24:57+00:00,0,0,,El Guabo
1146484876104937473,PuntaPacificoOK,Máncora. Perú hoy miércoles 3 julio 2019 a las 06:30hrs. Se ve ya claro y sol radiante a pesar de estar en invierno. Se observa el acceso a la playa. Nuestro Hospedaje entrando a la mano izquierda. Buena época para… https://www.instagram.com/p/Bzdrr-enA-W/?igshid=1329v043lq43e …,2019-07-03 18:24:29+00:00,0,0,,El Guabo
1146484532679495682,PuntaPacificoOK,Máncora. Perú hoy miércoles 3 julio 2019 a las 06:30hrs. Se ve ya claro y sol radiante a pesar de estar en invierno. Se observa el acceso a la playa. Nuestro Hospedaje entrando a la mano izquierda. Buena época para… https://www.instagram.com/p/Bzdrr-enA-W/?igshid=gmcoc0cjljwy …,2019-07-03 18:23:07+00:00,0,0,,El Guabo
1146481152364093442,PuntaPacificoOK,Máncora. Perú hoy miércoles 3 julio 2019 a las 06:30hrs. Se ve ya claro y sol radiante a pesar de estar en invierno. Se observa el acceso a la playa. Nuestro Hospedaje entrando a la mano izquierda. Buena época para… https://www.instagram.com/p/Bzdrr-enA-W/?igshid=we2e2mtsvxd4 …,2019-07-03 18:09:41+00:00,0,0,,El Guabo
1129066641768308739,gabyele10,Que me late que solo se lo han llevado a pasar sus últimos días de hospedaje en ese lugar ojalá sea eso y que no esté grave el trujillo,2019-05-16 16:50:39+00:00,0,0,,El Guabo
1127432399606829059,galitomiranda,en Hospedaje Sol De Mancora https://www.instagram.com/p/BxWWwWdnyC4ap9U1XIGx-26MgzxZS-eL_KuyVc0/?utm_source=ig_twitter_share&igshid=1nodsfjg5amsr …,2019-05-12 04:36:45+00:00,0,0,,El Guabo
1124680695962533889,MinturZonal7,Cuando viajes anticipa tu hospedaje y planifica tu recorrido por tu seguridad y la de tu familia. #ViajaSeguroECpic.twitter.com/QatQi9jOra,2019-05-04 14:22:28+00:00,1,2,#ViajaSeguroECpic,El Guabo
1160185098916040704,carturoleon,Te faltó decir viajar 6 8 12 horas por tierra sin hospedaje a duras penas algo de comer y directo al partido(hablo de las categorías menores) ni el agua muchas de las veces después de los entrenamientos y con 3 balones para todo el equipo y hecho huevo.,2019-08-10 13:44:17+00:00,1,0,,Huaquillas
1155548709502869504,EvosMusic,#tbs hace unos años atrás con @japylora unos panas todo bien buen recuerdo en D'Camus Casa Hospedaje https://www.instagram.com/p/B0eIkuxn1LY/?igshid=1gmtdap4mfssj …,2019-07-28 18:40:56+00:00,0,0,#tbs,Huaquillas
1122688531611176965,rspolito,El muchacho estaba todo sucio se notaba que lo habían drogado para robarlo le ofrecí comida y hospedaje pero no quiso estaba desorientado y desconfiaba me puse en contacto con la familia y pudieron hablar con el,2019-04-29 02:26:19+00:00,1,0,,Huaquillas
1124535048198344704,MinturZonal6,Cuando viajes anticipa tu hospedaje y planifica tu recorrido por tu seguridad y la de tu familia. #ViajaSeguroECpic.twitter.com/UaGVPBgl0I,2019-05-04 04:43:42+00:00,0,0,#ViajaSeguroECpic,Machala
1158944847585316864,Alexrivaden1895,Alguien que me preste una cuenta Paypal yo me encargo de que depositarle y descuenten mi dinero? La mía se pudrió por intentar reservar tickets aéreos y necesito pagar hospedaje mas otros gastos :(,2019-08-07 03:35:58+00:00,0,0,,Alfredo Baquerizo Moreno
1159960152012939269,CooperativaJEP,En este feriado paga tus consumos de gastronomía viajes hospedaje y mucho más con #TarjetasJEP. Aprovecha los descuentos y promociones exclusivas.,2019-08-09 22:50:25+00:00,8,1,#TarjetasJEP,Balao
1159602049148948481,CooperativaJEP,En tus #VacacionesAlMáximo disfruta de promociones y descuentos exclusivos en hospedaje y estadía con #TarjetasJEP. Más información http://bit.ly/2YvofJo pic.twitter.com/sl9qeoZQqp,2019-08-08 23:07:27+00:00,4,0,#VacacionesAlMáximo #TarjetasJEP,Balao
1158375712233021446,peluditoscuenc,Tenemos en hospedaje un gigante llamado #Chaplin es del mismo tamaño que #Dilan pero de una ternura y amor únicos #CasaDeLosPeluditos … https://www.instagram.com/p/B0yOJXWpHWy/?igshid=1etw7zcgst5gc …,2019-08-05 13:54:26+00:00,1,1,#Chaplin #Dilan #CasaDeLosPeluditos,Balao
1132859665686192129,patoedg,Lo imperativo de q exista regulacion y control a este tipo de hospedaje q garantice seguridad a quien lo utilice @fenacapturec @TurismoEc @Captur_Azuay @TurismoCuencaEChttps://elcomercio.pe/mundo/latinoamerica/muerte-brasilenos-intoxicados-chile-plantea-dudas-airbnb-noticia-638145 …,2019-05-27 04:02:46+00:00,5,2,,Balao
1125740392396333056,patoedg,Siguen en otros países problemas con @arbnb q auspicia la informalidad lo q se debe hacer es formalizar a quienes ofrecen hospedaje por estas plataformas virtuales @fenacapturec @TurismoEc @tomebambahttps://www.cnnchile.com/economia/airbnb-arriendo-departamento-las-condes_20190321/ …,2019-05-07 12:33:19+00:00,5,4,,Balao
1125186772277895168,llerenagilces28,Quinta San Martin gracias por el excelente hospedaje. #HermosoLugarpic.twitter.com/LfbB8eLJfa,2019-05-05 23:53:26+00:00,2,1,#HermosoLugarpic,Balao
1159843505604157445,PUNTAHILLS,Empezó el Feriado ... Y Montañita lo sabe ... . Ofrecemos : Desayunos Buffet $3 Almuerzos $5 Cenas & Show $7 . Uso de todas las instalaciones $5 . Hospedaje : Habitaciones Grupales $15/17 pp Matrimoniales… https://www.instagram.com/p/B08pnfZH0Hx/?igshid=1r0ao55u8yct0 …,2019-08-09 15:06:55+00:00,0,0,,Daule
1158555800832479232,PUNTAHILLS,Este Viernes 9 de Agosto los esperamos .. . Hospedaje aún disponible . groove_uio Club en Escena con todos sus Djs .. . De 12 a 12 de la noche .. . #puntahillshotel #puntahillsparty #poolparty #music #electronic… https://www.instagram.com/p/B0zgCoQHpE0/?igshid=18ezbmsr2f9v4 …,2019-08-06 01:50:02+00:00,0,0,#puntahillshotel #puntahillsparty #poolparty #music #electronic,Daule
1158088653370994688,torkixs,Bajense al app de Selina Lifestyle y suscribanse con este código para ganar 1000 tokens solo hoy que podrán intercambiar por productos en cualquier #Selina del mundo hospedaje comidas bebidas y descuentos... Go… https://www.instagram.com/p/B0wLm2HHuqM/?igshid=6j85smnln4vk …,2019-08-04 18:53:45+00:00,0,0,#Selina,Daule
1155984004618706945,PUNTAHILLS,Promoción este fin de semana en Matrimoniales en Hotel Punta Hills . . Reserva: Hospedaje / Desayuno Buffet/ Cena especial & show . Información: 0991776618 . #montañita #romantico #matrimonial #suiteveranera… https://www.instagram.com/p/B0hOhJ7nk1w/?igshid=i9w2osctazd …,2019-07-29 23:30:38+00:00,0,0,#montañita #romantico #matrimonial #suiteveranera,Daule
1155125227434729472,PUNTAHILLS,Hospedaje Disponible para Hoy Sábado en Hills .. . Reserva al 0992169613 / 0991776618 . Recuerda con nuestra Pulsera entras Gratis a pocolocomontanita . #montañita #puntahillshotel #sabado #fiestasjulianas… https://www.instagram.com/p/B0bH_jNHLRA/?igshid=sfozv18eg1ut …,2019-07-27 14:38:10+00:00,0,0,#montañita #puntahillshotel #sabado #fiestasjulianas,Daule
1154495846467002368,PUNTAHILLS,Sorpresas en Punta Hills & @lostbeachclub ... Nuestra Pulsera te hace entrar GRATIS ESTE VIERNES 26 .. Y HappyHour hasta las 1:00 am ... . Hospedaje en Hills desde $11.00 en cabañas y $15 las grupales .. . Ahiiii… https://www.instagram.com/p/B0WpyHwnkse/?igshid=d6zcbj1ir92l …,2019-07-25 20:57:13+00:00,0,0,,Daule
1154447509181358082,PUNTAHILLS,Simplemente Punta Hills ... . Reserva Hospedaje & Tours Al 0991776618 / 0992169613 . #montañita #puntahillshotel #hotel #tours #rutadelspondylus #julio #agosto #promocion en Montañita Ecuador https://www.instagram.com/p/B0WTzTvHIQj/?igshid=8k4ufqf8e79d …,2019-07-25 17:45:09+00:00,0,0,#montañita #puntahillshotel #hotel #tours #rutadelspondylus #julio #agosto #promocion,Daule
1154132843364278272,PUNTAHILLS,Hospedaje - Shows - Cumpleaños - Cenas - Tours ... Y mucha diversión te espera este fin de semana en Montañita .. . Reserva al 0991776618 . Hospedajes en Grupales desde $15.00 x persona . #puntahillshotel… https://www.instagram.com/p/B0UEtdknH5_/?igshid=krf9vdv278m7 …,2019-07-24 20:54:47+00:00,0,0,#puntahillshotel,Daule
1153877462872449024,PUNTAHILLS,Todo en un solo lugar en este Feriado.. . Reserva Hospedaje - Tours Al 0991776618 . #apartamento #habitación #suite #puntahillshotel #montañita #rutadelspondylus en Punta Hills Montanita https://www.instagram.com/p/B0SQksSnwLn/?igshid=10orfc3huz9es …,2019-07-24 03:59:59+00:00,0,0,#apartamento #habitación #suite #puntahillshotel #montañita #rutadelspondylus,Daule
1152689073817116673,PUNTAHILLS,Es increíble cuando encuentras tu lugar favorito ... . Reserva Hospedaje y Tours al 0991776618 . #montañita #puntahillsparadise #hotel #sabado #concierto #promocion #cocteles en Punta Hills Montanita https://www.instagram.com/p/B0J0KI_ngFG/?igshid=tx5ngg18a6k …,2019-07-20 21:17:45+00:00,0,0,#montañita #puntahillsparadise #hotel #sabado #concierto #promocion #cocteles,Daule
1151872812283379714,PUNTAHILLS,El año se va Volando ... . Fiestas de Navidad y Fin de Año .. Ofrecemos : Hospedaje Desayunos Buffet Cenas especiales Show y Música en Vivo . Reserva anticipadamente y gánate un buen Descuento . Información:… https://www.instagram.com/p/B0EA95znHw2/?igshid=ertipqi8z716 …,2019-07-18 15:14:13+00:00,0,0,,Daule
1151539595806433280,PUNTAHILLS,El Verano está aquí ... Y MONTAÑITA te espera . Pack 3 Días y 2 Noches Hospedaje (grupales) Desayunos Concierto Fiesta Uso de todas las instalaciones Valor $28.00 x persona ( $14 x persona la noche )… https://www.instagram.com/p/B0Bpb61Hxhw/?igshid=nqgtneh1vmvs …,2019-07-17 17:10:08+00:00,0,0,,Daule
1151130490524430336,PUNTAHILLS,Hotel en Montañita - Ecuador .. . Pack Estudiantil para 20 personas en Adelante 3Dias y 2 Noches : Incluye: Hospedaje en Grupales Privadas Desayunos Concierto y Fiesta en el Hotel Uso de todas las… https://www.instagram.com/p/Bz-utjOHCTY/?igshid=11f6oan1fah77 …,2019-07-16 14:04:30+00:00,1,1,,Daule
1151127025375166464,PUNTAHILLS,Promociones en Punta Hills este mes de Julio : 2 días 1 Noche Suites : Veranera $66 Cielo $85 Penthouse con Jacuzzi $120 . Te incluimos : Hospedaje Desayuno Buffet Cena Romántica Cóctel de bienvenida Concierto… https://www.instagram.com/p/Bz-t0ajHtwZ/?igshid=7vikc3mut3vu …,2019-07-16 13:50:44+00:00,0,0,,Daule
1149290834610667525,PUNTAHILLS,Te llevamos a conocer La Ruta y sus maravillas ... . Hospedaje y Tours . Reserva al 0991776618 . #montañita #puntahillshotel #rutadelspondylus #hotel en Punta Hills Montanita https://www.instagram.com/p/Bzxqo2FHHxT/?igshid=8usuqx06b4om …,2019-07-11 12:14:22+00:00,0,0,#montañita #puntahillshotel #rutadelspondylus #hotel,Daule
1149019668402884611,PUNTAHILLS,Vive Ecuador ... Con los mejores ... Hotel Punta Hills Montañita ... Tours en la Ruta del Sol .. . Reserva al 0991776618 . Hospedaje Habitacion Grupal $15 pp Matrimonial $50 pareja Suites $75 pareja . #montañita… https://www.instagram.com/p/BzvvgVgnx4r/?igshid=1u8xyxuiusmbn …,2019-07-10 18:16:51+00:00,0,0,#montañita,Daule
1148655241081978880,PUNTAHILLS,4 Suites Cielos Dobles y Matrimoniales Con balcón y Hamaca Vista al mar y Montañas Tv cable y Baño privado Wifi . Las mejores de Hills . Reserva al 0991776618 . Promoción: Hospedaje pareja Desayunos Cenas… https://www.instagram.com/p/BztJyCmHaOa/?igshid=ce7zt6kb4oej …,2019-07-09 18:08:45+00:00,1,1,,Daule
1147674629177323520,PUNTAHILLS,PROMOCIÓN para Colegio y Universidades Este Mes de Julio y Agosto. Pack Estudiantil: 3 Días 2 Noches Hospedaje Desayuno Tour a Ballenas Fiesta Opción: Almuerzo o Cena . Reserva : 0991776618 . #montañita… https://www.instagram.com/p/BzmLcSUHTUt/?igshid=nhl2nzz7bu1v …,2019-07-07 01:12:09+00:00,1,1,#montañita,Daule
1146139426558373888,PUNTAHILLS,Hotel Punta Hills Montañita Julio - Pack Love 2 días 1 Noche Hospedaje Cena Romántica Tour a las Ballenas Desayuno Buffet Precios : Suite Veranera $120 Suite Cielo $150 Penthouse $200 . Reserva al… https://www.instagram.com/p/BzbRucynSX2/?igshid=x07s3oobgs4g …,2019-07-02 19:31:48+00:00,0,0,,Daule
1146130447644028928,PUNTAHILLS,Julio y el Verano en Montañita & La Ruta del Sol ... muchas aventuras nuevas . Reserva Hospedaje y Tours al 0991776618 . #puntahillsmontanita #hotel #travel #tripadvisor #tours en Punta Hills Montanita https://www.instagram.com/p/BzbNou0HwDz/?igshid=1g3d62gb9errg …,2019-07-02 18:56:07+00:00,0,0,#puntahillsmontanita #hotel #travel #tripadvisor #tours,Daule
1145007424564334593,PUNTAHILLS,Atrévete a Soñar ... Especial del Columpio de los Deseos.. Tour en bote a las Ballenas $25.00 x persona . Hospedaje en Grupales desde $15 x pp incluido desayuno . Reserva al 0991776618 / 0992169613… https://www.instagram.com/p/BzTO8s-H5mg/?igshid=bwe4zubju7ye …,2019-06-29 16:33:37+00:00,0,0,,Daule
